prdtName,Brand,url,rating-info,price,type
Shingmulnara Light Watery Sun Gel 60ml*2ea (+Foam Cleanser 15ml+Cleansing Oil 10ml),Shingmulnara,https://global.oliveyoung.com/product/detail?prdtNo=GA250531039,,US$17.90,Face Sunscreen
GOONGBE Fresh Sun Stick Mild 23g Set (+Phone Grip),GOONGBE,https://global.oliveyoung.com/product/detail?prdtNo=GA250531038,,US$19.60,Face Sunscreen
GOONGBE Moisture Sun Cushion Mild 14g Set (+Phone Grip),GOONGBE,https://global.oliveyoung.com/product/detail?prdtNo=GA250531037,,US$19.60,Face Sunscreen
APLB Collagen EGF Peptide Sunscreen 40ml,APLB,https://global.oliveyoung.com/product/detail?prdtNo=GA250530974,,US$10.78,Face Sunscreen
APLB Retinol Vitamin C Vitamin E Sunscreen 40ml,APLB,https://global.oliveyoung.com/product/detail?prdtNo=GA250530973,,US$10.78,Face Sunscreen
FROMRIER 5GF Tone Up Sun Ampoule BB #Teal Blue 56ml,FROMRIER,https://global.oliveyoung.com/product/detail?prdtNo=GA250530970,4.7,US$40.00,Face Sunscreen
INNISFREE Vitamin C Tone Up Sunscreen 50ml 1+1 Set,INNISFREE,https://global.oliveyoung.com/product/detail?prdtNo=GA250530969,4.5,US$29.45,Face Sunscreen
OGANACELL Bio Actiome Sunscreen 50ml,OGANACELL,https://global.oliveyoung.com/product/detail?prdtNo=GA250530865,,US$49.14,Face Sunscreen
TOCOBO Blur Finish Sun Cushion 01 Cotton Blue,TOCOBO,https://global.oliveyoung.com/product/detail?prdtNo=GA250530864,,US$26.60,Face Sunscreen
Cell Fusion C Aquatica Stick Sunscreen 100 19g,Cell Fusion C,https://global.oliveyoung.com/product/detail?prdtNo=GA250530862,,US$15.95,Face Sunscreen
Dinsee Premium Vegan Tone Up Sunscreen 50ml Set (+Cleansing Foam 40ml),Dinsee,https://global.oliveyoung.com/product/detail?prdtNo=GA250530859,,US$17.50,Face Sunscreen
GROUND LAB Natural Light Sun Tone Up 50ml,Ground Lab,https://global.oliveyoung.com/product/detail?prdtNo=GA250530819,,US$27.84,Face Sunscreen
TOCOBO Blur Finish Sun Cushion 00 Pure,TOCOBO,https://global.oliveyoung.com/product/detail?prdtNo=GA250530818,4.0,US$26.60,Face Sunscreen
Troubless Oilless Mild Wter Airy Fit Sun Cream 77ml,Troubless,https://global.oliveyoung.com/product/detail?prdtNo=GA250530816,,US$33.00,Face Sunscreen
zerocipe Nanocentella Sun Essence 50ml,zerocipe,https://global.oliveyoung.com/product/detail?prdtNo=GA250530815,,US$36.00,Face Sunscreen
COSRX Airy-Light Invisible Sun Stick 19g,COSRX,https://global.oliveyoung.com/product/detail?prdtNo=GA250530814,5.0,US$23.47,Face Sunscreen
[DISNEY EDITION] goodal Heartleaf Soothing Hyaluron Sun Serum 50ml Set (+20ml),goodal,https://global.oliveyoung.com/product/detail?prdtNo=GA250530813,4.9,US$31.00,Face Sunscreen
[DISNEY EDITION] goodal Heartleaf Calming Cooling Sun Stick 19g 1+1 Set,goodal,https://global.oliveyoung.com/product/detail?prdtNo=GA250530812,4.7,US$26.00,Face Sunscreen
[DISNEY EDITION] goodal Heartleaf Soothing Tone Up Sun Cream 50ml 1+1 Set,goodal,https://global.oliveyoung.com/product/detail?prdtNo=GA250530811,4.3,US$21.15,Face Sunscreen
Bushman Waterproof Surfing Sun Stick 20g Set (+Daily Sun Cream 20ml),Bushman,https://global.oliveyoung.com/product/detail?prdtNo=GA250530807,5.0,US$21.46,Face Sunscreen
veramore Brightening Glowing Sun Serum 50ml,veramore,https://global.oliveyoung.com/product/detail?prdtNo=GA250530640,,US$24.50,Face Sunscreen
ETUDE Soonjung Director’s Moisture Sun Cream 50ml Set (+pH 5.6 Cleansing Milk 65ml),ETUDE,https://global.oliveyoung.com/product/detail?prdtNo=GA250530639,5.0,US$17.40,Face Sunscreen
EDIT.B Sunday Tone-Up Sun Serum #Pink 55ml SPF50+ PA++++,EDIT.B,https://global.oliveyoung.com/product/detail?prdtNo=GA250530599,,US$20.30,Face Sunscreen
BRINGGREEN Tea Tree Cica Cooling Sun Stick 20g+Refill 20g Set (+Mini Sun Cushion 5g),BRINGGREEN,https://global.oliveyoung.com/product/detail?prdtNo=GA250530597,4.0,US$20.76,Face Sunscreen
AHC Masters Soothing Outdoor Sun Spray 55ml,AHC,https://global.oliveyoung.com/product/detail?prdtNo=GA250430351,4.8,US$19.20,Face Sunscreen
Primera Repairing Cera Capsule UV Protector Double Pack (40ml+40ml),Primera,https://global.oliveyoung.com/product/detail?prdtNo=GA250430290,,US$55.00,Face Sunscreen
celimax Dual Barrier Watery Sun Cream 40ml,celimax,https://global.oliveyoung.com/product/detail?prdtNo=GA250430272,4.8,US$21.00,Face Sunscreen
Dinsee Premium Vegan Tone Up Sunscreen 50ml 1+1 Set (+Cleansing Foam 40ml),Dinsee,https://global.oliveyoung.com/product/detail?prdtNo=GA250430268,5.0,US$33.71,Face Sunscreen
[NICE WEATHER EDITION] AGE20’s Sun Essence Pact Calming Long Protection 12.5g,AGE 20's,https://global.oliveyoung.com/product/detail?prdtNo=GA250430264,,US$29.60,Face Sunscreen
FRUDIA Blueberry Hydrating Air Fit Sunscreen 50g,FRUDIA,https://global.oliveyoung.com/product/detail?prdtNo=GA250430246,5.0,US$16.10,Face Sunscreen
Franz Naked Sunshield Peptide Sun Cream 50ml,Franz,https://global.oliveyoung.com/product/detail?prdtNo=GA250430217,,US$29.00,Face Sunscreen
B.READY Hydro Sweatproof Sunscreen 50ml,B.READY,https://global.oliveyoung.com/product/detail?prdtNo=GA250430216,,US$23.08,Face Sunscreen
[No. 1 MARU EDITON] athe Vegan Relief Sun Essence EX SPF50+ PA++++ 50ml Set (+35ml+MARU Sun Cushion Case),athe,https://global.oliveyoung.com/product/detail?prdtNo=GA250430095,4.8,US$32.00,Face Sunscreen
WELLAGE Real Hyaluronic Blue Sun Cream 50ml,WELLAGE,https://global.oliveyoung.com/product/detail?prdtNo=GA250430094,5.0,US$20.30,Face Sunscreen
[TOSUNI PINK EDITION] athe Vegan Relief Tone Up Sun Essence SPF+ PA++++ 50ml Set (+Tosuni Keyring),athe,https://global.oliveyoung.com/product/detail?prdtNo=GA250429930,,US$32.00,Face Sunscreen
CNP After-Ray Barrier Repairing Sun 50ml Double Pack,CNP,https://global.oliveyoung.com/product/detail?prdtNo=GA250429924,5.0,US$26.25,Face Sunscreen
CNP After-Ray Watery Tone Up Sun 50ml Double Pack,CNP,https://global.oliveyoung.com/product/detail?prdtNo=GA250429923,4.6,US$26.25,Face Sunscreen
CNP After-Ray Tone Up Protection Sun 50ml Double Pack,CNP,https://global.oliveyoung.com/product/detail?prdtNo=GA250429922,,US$29.75,Face Sunscreen
LANEIGE Water Bank UV Barrier Sunscreen 50ml SPF50+ PA++++,LANEIGE,https://global.oliveyoung.com/product/detail?prdtNo=GA250429921,5.0,US$26.40,Face Sunscreen
ANESSA Brightening UV Sunscreen Gel 90g Set (+15g*2ea),ANESSA,https://global.oliveyoung.com/product/detail?prdtNo=GA250429920,5.0,US$29.75,Face Sunscreen
I'm from Rice Sunscreen 50ml,I'm from,https://global.oliveyoung.com/product/detail?prdtNo=GA250429919,,US$28.80,Face Sunscreen
GOONGBE Baby Easy Wash Sun Lotion 60g,GOONGBE,https://global.oliveyoung.com/product/detail?prdtNo=GA250429917,,US$24.00,Face Sunscreen
[MARU BEIGE EDITION] athe Vegan Relif Tone Up Sun Essence SPF+ PA++++ 50ml Set (+Maru Keyring),athe,https://global.oliveyoung.com/product/detail?prdtNo=GA250429916,4.0,US$32.00,Face Sunscreen
medicube Zero Pore Moisture Sun Serum 50ml,medicube,https://global.oliveyoung.com/product/detail?prdtNo=GA250429914,5.0,US$21.20,Face Sunscreen
[HELINOX EDITION] SUM37 Sun-away Velvet Sun Stick Set,SUM37,https://global.oliveyoung.com/product/detail?prdtNo=GA250429913,,US$33.60,Face Sunscreen
Shingmulnara White Rice Bright Tone Up Sun Cushion 15g 04 Fresh Green,Shingmulnara,https://global.oliveyoung.com/product/detail?prdtNo=GA250429797,4.1,US$11.56,Face Sunscreen
Shingmulnara White Rice Bright Tone Up Sun Cushion 15g Refill Set 04 Green,Shingmulnara,https://global.oliveyoung.com/product/detail?prdtNo=GA250429796,5.0,US$18.47,Face Sunscreen
ANESSA Perfect UV Sunscreen Skincare Gel 90g Set (+15g*2ea),ANESSA,https://global.oliveyoung.com/product/detail?prdtNo=GA250329778,4.5,US$29.75,Face Sunscreen
La'dor Tamanu Oil Sun Stick 21g,La'dor,https://global.oliveyoung.com/product/detail?prdtNo=GA250329738,,US$24.59,Face Sunscreen
La'dor Tamanu Airy Sunscreen 50ml,La'dor,https://global.oliveyoung.com/product/detail?prdtNo=GA250329737,,US$23.80,Face Sunscreen
Scinic UV Expert Tone Up Sun Essence SPF50+ PA++++ 50ml,Scinic,https://global.oliveyoung.com/product/detail?prdtNo=GA250329736,,US$22.40,Face Sunscreen
House of B Glutathione Sun Ampoule 50ml,House of B,https://global.oliveyoung.com/product/detail?prdtNo=GA250329692,,US$27.03,Face Sunscreen
ANESSA Perfect UV Sunscreen Skincare Milk 60ml (Pengdori),ANESSA,https://global.oliveyoung.com/product/detail?prdtNo=GA250329678,,US$43.00,Face Sunscreen
Primera Repairing Cera-Capsule UV Protector Tone Up Priming Double Pack (40ml+40ml),Primera,https://global.oliveyoung.com/product/detail?prdtNo=GA250329677,,US$55.00,Face Sunscreen
Shingmulnara Light Watery Sun Gel 60ml,Shingmulnara,https://global.oliveyoung.com/product/detail?prdtNo=GA250329672,5.0,US$16.78,Face Sunscreen
Dewytree Urban Shade Moisture Serum Sun 50ml,Dewytree,https://global.oliveyoung.com/product/detail?prdtNo=GA250329664,5.0,US$22.05,Face Sunscreen
ONE THING Cica B5 Sun Cream 50ml,ONE THING,https://global.oliveyoung.com/product/detail?prdtNo=GA250329568,4.8,US$17.02,Face Sunscreen
SNP Glutathione + Niacinamide UV Filter Toning Sun Cream 50ml Set (+20ml),SNP,https://global.oliveyoung.com/product/detail?prdtNo=GA250329567,,US$24.00,Face Sunscreen
so natural All Day Sun Fixx Skin Fit Beige SPF50+ PA++++ 50ml,so natural,https://global.oliveyoung.com/product/detail?prdtNo=GA250329565,4.3,US$21.00,Face Sunscreen
so natural All Day Sun Fixx Tone Up Pink SPF50+ PA++++ 50ml,so natural,https://global.oliveyoung.com/product/detail?prdtNo=GA250329564,5.0,US$21.00,Face Sunscreen
Abib Glutathiosome CC Sunscreen Toning Tube 50ml,Abib,https://global.oliveyoung.com/product/detail?prdtNo=GA250329536,,US$17.50,Face Sunscreen
Abib Sedum Hyaluron Sunscreen Watery Tube 50ml,Abib,https://global.oliveyoung.com/product/detail?prdtNo=GA250329535,4.8,US$17.50,Face Sunscreen
Abib Sunscreen Tube 50ml (3 Types),Abib,https://global.oliveyoung.com/product/detail?prdtNo=GA250329534,4.5,US$17.50,Face Sunscreen
REJURAN Healer UV Protection Cream 40ml Set (+UV Protection Cream 10ml*2ea+Derma Healer Ampoule 1ml*3ea),REJURAN,https://global.oliveyoung.com/product/detail?prdtNo=GA250329437,4.7,US$28.00,Face Sunscreen
FATION Nosca9 UV Aging Skin Barrier Sun Serum 40ml Set (+Barrier Sun 10ml+Moisture Sun 10ml),FATION,https://global.oliveyoung.com/product/detail?prdtNo=GA250329391,4.2,US$21.96,Face Sunscreen
AHC Masters Aqua Rich Sun Cream 50ml 1+1 Set,AHC,https://global.oliveyoung.com/product/detail?prdtNo=GA250329270,4.8,US$27.96,Face Sunscreen
Dr.G Vita Clear Waterproof Sun Stick 21g,Dr.G,https://global.oliveyoung.com/product/detail?prdtNo=GA250329211,4.7,US$29.00,Face Sunscreen
TOCOBO Vita Airy Sun Primer 35ml,TOCOBO,https://global.oliveyoung.com/product/detail?prdtNo=GA250329207,4.8,US$26.00,Face Sunscreen
TOCOBO Vita Waterproof Sun Stick 18g,TOCOBO,https://global.oliveyoung.com/product/detail?prdtNo=GA250329206,4.8,US$18.91,Face Sunscreen
INNISFREE Vita C Tone Up Sunscreen 50ml 1+1 Set,INNISFREE,https://global.oliveyoung.com/product/detail?prdtNo=GA250329205,4.1,US$29.45,Face Sunscreen
INNISFREE Vita C Tone Up Sunscreen 50ml,INNISFREE,https://global.oliveyoung.com/product/detail?prdtNo=GA250329204,4.0,US$29.45,Face Sunscreen
Eucerin Sun Face Hydro Protect SPF50+ 50ml*2ea Set,Eucerin,https://global.oliveyoung.com/product/detail?prdtNo=GA250329199,4.7,US$36.41,Face Sunscreen
Ariul Green Vitamin C Brightening Sun Cream 50ml,Ariul,https://global.oliveyoung.com/product/detail?prdtNo=GA250329113,,US$17.50,Face Sunscreen
Mamonde Flora Glow Rose Tinted Sun Serum 35ml Set (+Rose Liquid Mask 15ml),Mamonde,https://global.oliveyoung.com/product/detail?prdtNo=GA250329085,4.3,US$26.10,Face Sunscreen
Purito Seoul Daily Soft Touch Sunscreen Stick,Purito Seoul,https://global.oliveyoung.com/product/detail?prdtNo=GA250229077,4.7,US$16.12,Face Sunscreen
Eucerin Sun Face Hydro Protect SPF50+ 50ml,Eucerin,https://global.oliveyoung.com/product/detail?prdtNo=GA250228799,,US$22.20,Face Sunscreen
NATURE REPUBLIC California Aloe Fresh Powdery Sun Stick 24g,NATURE REPUBLIC,https://global.oliveyoung.com/product/detail?prdtNo=GA250228797,4.7,US$21.00,Face Sunscreen
Torriden Dive In Soothing Sun Stick 19g,Torriden,https://global.oliveyoung.com/product/detail?prdtNo=GA250228758,4.6,US$26.00,Face Sunscreen
Torriden Dive In Moisture Sun Cream 60ml (RENEWAL),Torriden,https://global.oliveyoung.com/product/detail?prdtNo=GA250228757,4.7,US$23.08,Face Sunscreen
Torriden Dive In Tone Up Sun Cream Purple 60ml,Torriden,https://global.oliveyoung.com/product/detail?prdtNo=GA250228756,,US$29.00,Face Sunscreen
[Teenieping EDITION] goodal Heartleaf Claming Mineral Filter Sun Cream 50ml 1+1 Set,goodal,https://global.oliveyoung.com/product/detail?prdtNo=GA250228694,4.7,US$21.00,Face Sunscreen
[Teenieping EDITION] goodal Heartleaf Calming Tone Up Sun Cream 50ml 1+1 Set,goodal,https://global.oliveyoung.com/product/detail?prdtNo=GA250228693,4.5,US$21.15,Face Sunscreen
Torriden Dive In Soothing Sun Stick 19g*2ea Set,Torriden,https://global.oliveyoung.com/product/detail?prdtNo=GA250228659,4.7,US$25.20,Face Sunscreen
Torriden Dive In Watery Fit Sun Serum 50ml Set (+20ml),Torriden,https://global.oliveyoung.com/product/detail?prdtNo=GA250228657,4.7,US$23.08,Face Sunscreen
Torriden Dive In Purple Tone Up Sunscreen 60ml Set (+20ml),Torriden,https://global.oliveyoung.com/product/detail?prdtNo=GA250228656,4.2,US$29.00,Face Sunscreen
COSNORI Airy Tone Up Sun Serum 50ml,COSNORI,https://global.oliveyoung.com/product/detail?prdtNo=GA250228510,4.0,US$33.00,Face Sunscreen
COSNORI Airy Sun Serum 50ml,COSNORI,https://global.oliveyoung.com/product/detail?prdtNo=GA250228509,,US$33.00,Face Sunscreen
ETUDE Soonjung Director’s Moisture Sun Cream 50ml 1+1 Set,ETUDE,https://global.oliveyoung.com/product/detail?prdtNo=GA250228496,4.9,US$26.56,Face Sunscreen
Dewytree Urban Shade Cover & Fit Sun 40ml,Dewytree,https://global.oliveyoung.com/product/detail?prdtNo=GA250228493,5.0,US$15.40,Face Sunscreen
Dewytree Urban Shade Anti-Polllution Sun 50ml,Dewytree,https://global.oliveyoung.com/product/detail?prdtNo=GA250228492,5.0,US$16.80,Face Sunscreen
d’Ala Waterfull Tone Up Sun Cream (Green Correcting) Duo Set (50ml+50ml),d'Alba,https://global.oliveyoung.com/product/detail?prdtNo=GA250228488,4.5,US$59.00,Face Sunscreen
mixsoon Bean Sun Serum 50ml,mixsoon,https://global.oliveyoung.com/product/detail?prdtNo=GA250228485,4.8,US$27.90,Face Sunscreen
beplain Sunmuse Tone Up & Correcting Sunscreen 50ml 1+1 Set,beplain,https://global.oliveyoung.com/product/detail?prdtNo=GA250228484,4.5,US$29.45,Face Sunscreen
AESTURA Derma UV365 Vita-C Radiance Sunscreen 40ml,AESTURA,https://global.oliveyoung.com/product/detail?prdtNo=GA250228411,,US$41.00,Face Sunscreen
AESTURA Derma UV365 Vita-C Radiance Sunscreen 40ml Set (+20ml),AESTURA,https://global.oliveyoung.com/product/detail?prdtNo=GA250228410,4.6,US$41.00,Face Sunscreen
Shingmulnara White Rice Bright Tone Up Sun Cushion (25AD),Shingmulnara,https://global.oliveyoung.com/product/detail?prdtNo=GA250128366,4.4,US$11.56,Face Sunscreen
BRINGGREEN Super Lemon Glutathione Tone Up Sun Cream 50ml 1+1 Set,BRINGGREEN,https://global.oliveyoung.com/product/detail?prdtNo=GA250128219,4.8,US$20.11,Face Sunscreen
medicube PDRN Pink Tone Up Sun Cream 50ml,medicube,https://global.oliveyoung.com/product/detail?prdtNo=GA250128027,4.5,US$32.00,Face Sunscreen
goodal Heartleaf Soothing Hyaluron Sun Serum 50ml Set (+20ml),goodal,https://global.oliveyoung.com/product/detail?prdtNo=GA250127874,5.0,US$31.00,Face Sunscreen
goodal Heartleaf Soothing Tone Up Sun Cream 50ml 1+1 Set,goodal,https://global.oliveyoung.com/product/detail?prdtNo=GA250127873,,US$21.15,Face Sunscreen
Real Barrier Peach fit Tone-Up Sun Cream 50ml,Real Barrier,https://global.oliveyoung.com/product/detail?prdtNo=GA250127872,,US$34.00,Face Sunscreen
d'Alba Clean Tea Tree Liposome Tone-Up Sun Cream (Green) 50ml,d'Alba,https://global.oliveyoung.com/product/detail?prdtNo=GA250127871,5.0,US$28.00,Face Sunscreen
THE WHOO Gong Jin Hyang Sunquid 50ml,THE WHOO,https://global.oliveyoung.com/product/detail?prdtNo=GA250127751,,US$61.00,Face Sunscreen
Shingmulnara White Rice Purple Tone Up Moisture Sun Cream 100ml,Shingmulnara,https://global.oliveyoung.com/product/detail?prdtNo=GA250127744,4.3,US$12.84,Face Sunscreen
I'm from Apricot Clear Sun Serum 50ml,I'm from,https://global.oliveyoung.com/product/detail?prdtNo=GA250127742,4.9,US$26.25,Face Sunscreen
JAYJUN Hyaluronic Acid Hydrating Sun Cream 50ml 1+1 Double Pack (50ml+50ml),JAYJUN,https://global.oliveyoung.com/product/detail?prdtNo=GA241227408,4.7,US$19.08,Face Sunscreen
KAINE Green Fit Pro Sun 55ml,KAINE,https://global.oliveyoung.com/product/detail?prdtNo=GA241227308,,US$17.60,Face Sunscreen
easydew Mela B Toning Ampoule Cushion 15g No.19 Fair,easydew,https://global.oliveyoung.com/product/detail?prdtNo=GA241227245,4.4,US$44.84,Face Sunscreen
NOT4U Vegan Sun Body Mist 85ml,NOT4U,https://global.oliveyoung.com/product/detail?prdtNo=GA241227209,5.0,US$18.65,Face Sunscreen
TONEfitSUN Vegan Hydrating Sun Cream 50ml SPF50+ PA++++,TONEfitSUN,https://global.oliveyoung.com/product/detail?prdtNo=GA241227195,,US$18.20,Face Sunscreen
Mamonde Calming Shot Azulene Suncream 35ml SPF50+ PA++++,Mamonde,https://global.oliveyoung.com/product/detail?prdtNo=GA241227002,4.3,US$13.30,Face Sunscreen
12GRABS Vegan Comforting Sun 50ml,12GRABS,https://global.oliveyoung.com/product/detail?prdtNo=GA241126937,5.0,US$29.00,Face Sunscreen
MdoC Sun Skin + Cream 100ml (+30ml),MdoC,https://global.oliveyoung.com/product/detail?prdtNo=GA241126823,,US$34.40,Face Sunscreen
UIQ Biome Remedy Perfect Powdery Sun Stick 18g,UIQ,https://global.oliveyoung.com/product/detail?prdtNo=GA241126778,,US$28.00,Face Sunscreen
Bodiance Perfect Cover White Toning Tone Up Sun Lotion 200ml,Bodiance,https://global.oliveyoung.com/product/detail?prdtNo=GA241126755,5.0,US$40.00,Face Sunscreen
DEWY CEL No-Serum Sun Stick 18g,DEWY CEL,https://global.oliveyoung.com/product/detail?prdtNo=GA241126740,,US$24.36,Face Sunscreen
Dinsee Premium Vegan Tone Up Sun Cream 50ml Set (+Puff 1P),Dinsee,https://global.oliveyoung.com/product/detail?prdtNo=GA241026525,4.4,US$20.00,Face Sunscreen
Coverseoul Bestian Sunscreen 50ml,Coverseoul,https://global.oliveyoung.com/product/detail?prdtNo=GA241026480,,US$25.90,Face Sunscreen
ODELOI Pore Tightening Tone-Up Sun Cream Bllymi Fyldig 50ml,ODELOI,https://global.oliveyoung.com/product/detail?prdtNo=GA241026467,4.6,US$18.70,Face Sunscreen
BRTC Mild Sun Cream 50ml Set (+20ml),BRTC,https://global.oliveyoung.com/product/detail?prdtNo=GA241026126,,US$33.00,Face Sunscreen
Dinsee Premium Vegan Activity Sun Cream SPF50+ PA++++ 50ml,Dinsee,https://global.oliveyoung.com/product/detail?prdtNo=GA241026103,5.0,US$20.00,Face Sunscreen
THE SAEM UV Perfection Water Fit Soothing Sun Essence 50ml 1+1 Set,THE SAEM,https://global.oliveyoung.com/product/detail?prdtNo=GA241026102,,US$31.00,Face Sunscreen
THE SAEM UV Perfection Safe Barrier Sun Cream 50ml 1+1 Set,THE SAEM,https://global.oliveyoung.com/product/detail?prdtNo=GA241026101,4.3,US$31.00,Face Sunscreen
ETUDE Sunprise Mild Airy Finish Sun Milk 55ml,ETUDE,https://global.oliveyoung.com/product/detail?prdtNo=GA241026100,4.5,US$14.40,Face Sunscreen
S.NATURE Aqua 365 UV Sun 40ml,S.NATURE,https://global.oliveyoung.com/product/detail?prdtNo=GA240925936,4.6,US$17.88,Face Sunscreen
irecipe Mild Cica Brightening Up Sunscreen 50ml Double set,irecipe,https://global.oliveyoung.com/product/detail?prdtNo=GA240925926,,US$39.00,Face Sunscreen
irecipe Watery Touch Essence Sun Balm 10g Double set,irecipe,https://global.oliveyoung.com/product/detail?prdtNo=GA240925925,,US$25.66,Face Sunscreen
belif UV Protector Aqua Bomb Sun Serum 50ml,belif,https://global.oliveyoung.com/product/detail?prdtNo=GA240925917,5.0,US$35.20,Face Sunscreen
Bushman Hyaluronic Acid Daily Suncream 50ml Set (+20ml),Bushman,https://global.oliveyoung.com/product/detail?prdtNo=GA240925914,4.3,US$19.60,Face Sunscreen
BENTON Cica Moisture Sun Cream Cushion 15g,BENTON,https://global.oliveyoung.com/product/detail?prdtNo=GA240925913,4.5,US$23.00,Face Sunscreen
DEMAR3 DX Cita Du Aqua Sun Serum 50ml,DEMAR3,https://global.oliveyoung.com/product/detail?prdtNo=GA240925893,,US$43.00,Face Sunscreen
KAHI Airy Fit Sun Stick 14g Double Pack,KAHI,https://global.oliveyoung.com/product/detail?prdtNo=GA240925847,4.3,US$31.96,Face Sunscreen
FROMRIER 5GF Tone Up Sun BB Cream 60g,FROMRIER,https://global.oliveyoung.com/product/detail?prdtNo=GA240925661,4.5,US$32.94,Face Sunscreen
UIQ Biome Remedy Tone Up Sun Cream 50ml,UIQ,https://global.oliveyoung.com/product/detail?prdtNo=GA240925649,4.6,US$32.00,Face Sunscreen
Anua Peach Niacin UV Tone Up Protection 50ml,Anua,https://global.oliveyoung.com/product/detail?prdtNo=GA240925638,4.3,US$20.22,Face Sunscreen
Sunnicorn Bamboo Soothing Sun BB 40ml SPF50+ PA++++,Sunnicorn,https://global.oliveyoung.com/product/detail?prdtNo=GA240825511,,US$21.45,Face Sunscreen
Sunnicorn Bamboo Soothing UV Sun Essence 50ml SPF50+ PA++++,Sunnicorn,https://global.oliveyoung.com/product/detail?prdtNo=GA240825510,,US$33.00,Face Sunscreen
BENTON Mineral Sun Stick 15g,BENTON,https://global.oliveyoung.com/product/detail?prdtNo=GA240825496,5.0,US$18.66,Face Sunscreen
d'Alba Waterful Balancing Sun Cream 50ml,d'Alba,https://global.oliveyoung.com/product/detail?prdtNo=GA240825472,5.0,US$40.00,Face Sunscreen
KAHI Water Holding Tone Up Sun Serum 50ml,KAHI,https://global.oliveyoung.com/product/detail?prdtNo=GA240825461,,US$29.40,Face Sunscreen
KAHI Aqua Shield Sun Lotion 50ml,KAHI,https://global.oliveyoung.com/product/detail?prdtNo=GA240825460,,US$29.40,Face Sunscreen
VT Cica Sun Essence 100ml,VT,https://global.oliveyoung.com/product/detail?prdtNo=GA240825459,4.5,US$25.60,Face Sunscreen
VT PDRN Moist Tone Up Sun Essence 50g,VT,https://global.oliveyoung.com/product/detail?prdtNo=GA240825458,,US$25.90,Face Sunscreen
JAYJUN Hyaluronic Acid Hydrating Sun Cream 50ml,JAYJUN,https://global.oliveyoung.com/product/detail?prdtNo=GA240825445,4.3,US$11.88,Face Sunscreen
HERA UV Protector Multi-Defense Fresh SPF50+ PA++++ 50ml,HERA,https://global.oliveyoung.com/product/detail?prdtNo=GA240825129,4.7,US$47.00,Face Sunscreen
FROMRIER EGF Cica Bosong Sun Ampoule 56ml,FROMRIER,https://global.oliveyoung.com/product/detail?prdtNo=GA240825031,4.8,US$27.30,Face Sunscreen
UIQ Biome Remedy Watery Sun Cream 50ml,UIQ,https://global.oliveyoung.com/product/detail?prdtNo=GA240825023,4.5,US$32.00,Face Sunscreen
mixsoon Bean Sun Stick 15g,mixsoon,https://global.oliveyoung.com/product/detail?prdtNo=GA240724929,5.0,US$24.40,Face Sunscreen
mixsoon Cica-Hyal Sun Stick 15g,mixsoon,https://global.oliveyoung.com/product/detail?prdtNo=GA240724928,4.9,US$24.40,Face Sunscreen
ECLADO UV Tone Up Cover Sun Cream SPF50+ PA++++ 70g,ECLADO,https://global.oliveyoung.com/product/detail?prdtNo=GA240724868,,US$22.16,Face Sunscreen
ECLADO UV Oil Free Sun Cream SPF50+ PA++++ 70g,ECLADO,https://global.oliveyoung.com/product/detail?prdtNo=GA240724867,4.0,US$42.00,Face Sunscreen
Scott Hamish Classic Golf Sun Cream (SPF 50+ PA++++) 40ml,scotthamish,https://global.oliveyoung.com/product/detail?prdtNo=GA240724856,5.0,US$24.50,Face Sunscreen
Scott Hamish Classic Golf Sun Stick (SPF 50+ PA++++) 18.5g,scotthamish,https://global.oliveyoung.com/product/detail?prdtNo=GA240724855,,US$24.50,Face Sunscreen
luvum Hyaluronic Moisture Sun Cream 50ml,luvum,https://global.oliveyoung.com/product/detail?prdtNo=GA240724835,4.7,US$29.00,Face Sunscreen
SKIN1004 Madagascar Centella Probio-cica Glow Sun Ampoule 50ml,SKIN1004,https://global.oliveyoung.com/product/detail?prdtNo=GA240724743,4.8,US$17.00,Face Sunscreen
SKIN1004 Madagascar Centella Air-Fit Suncream Plus 50mL,SKIN1004,https://global.oliveyoung.com/product/detail?prdtNo=GA240724741,4.5,US$15.30,Face Sunscreen
A’pieu Pure Block Aqua Sun Gel EX 50ml,A'pieu,https://global.oliveyoung.com/product/detail?prdtNo=GA240724680,4.3,US$9.60,Face Sunscreen
Hemish Artless Glow Tinted Sunscreen 40ml,Heimish,https://global.oliveyoung.com/product/detail?prdtNo=GA240724667,4.5,US$23.40,Face Sunscreen
HYAAH Perfect Layering Sun Lotion 40ml,HYAAH,https://global.oliveyoung.com/product/detail?prdtNo=GA240724538,4.5,US$26.40,Face Sunscreen
KEYTH Pink Desert Sun Serum SPF50 PA++++,KEYTH,https://global.oliveyoung.com/product/detail?prdtNo=GA240724530,,US$33.00,Face Sunscreen
COSRX Ultra-Light Invisible Sunscreen 50ml Set (+Peptide Serum 30ml),COSRX,https://global.oliveyoung.com/product/detail?prdtNo=GA240724529,4.7,US$15.48,Face Sunscreen
MdoC Sun Skin + Cream 100ml,MdoC,https://global.oliveyoung.com/product/detail?prdtNo=GA240724515,,US$34.40,Face Sunscreen
irecipe Mild Hyaluronic Moist Up Sunscreen 50ml,irecipe,https://global.oliveyoung.com/product/detail?prdtNo=GA240724509,,US$21.00,Face Sunscreen
irecipe Watery Touch Essence Sun Balm 10g,irecipe,https://global.oliveyoung.com/product/detail?prdtNo=GA240724508,5.0,US$18.00,Face Sunscreen
irecipe Mild Cica Brightening Up Sunscreen 50ml,irecipe,https://global.oliveyoung.com/product/detail?prdtNo=GA240724507,,US$26.00,Face Sunscreen
SKIN&LAB Porebarrier Tinted Sunscreen 50ml,SKIN&LAB,https://global.oliveyoung.com/product/detail?prdtNo=GA240724498,4.5,US$22.40,Face Sunscreen
AHC Masters Mela Protect Waterful Sun Cream 40ml,AHC,https://global.oliveyoung.com/product/detail?prdtNo=GA240724464,4.8,US$33.00,Face Sunscreen
Dr.G Red Blemish Soothing Up Sun 50ml,Dr.G,https://global.oliveyoung.com/product/detail?prdtNo=GA240624360,4.9,US$26.10,Face Sunscreen
athe Vegan Relief Lighting Tone Up Sun Cushion SPF50+ PA++++ 12g,athe,https://global.oliveyoung.com/product/detail?prdtNo=GA240624211,4.1,US$24.50,Face Sunscreen
Cure Water Splash Cooling Sun Cream 40ml,Cure,https://global.oliveyoung.com/product/detail?prdtNo=GA240624189,5.0,US$16.12,Face Sunscreen
MONSIEURJ Perfect Proof Sun Stick 18.5g,MONSIEURJ,https://global.oliveyoung.com/product/detail?prdtNo=GA240624186,,US$21.26,Face Sunscreen
Medytox NERURADERM Intensive Sun Cream 50ml,NEURADERM,https://global.oliveyoung.com/product/detail?prdtNo=GA240624180,4.5,US$29.15,Face Sunscreen
