prdtName,Brand,url,rating-info,price,type
AboutMe Be Clean Tone Up Sun 1+1 Special Set (50mL+50mL),AboutMe,https://global.oliveyoung.com/product/detail?prdtNo=GA220313923,,US$29.00,Face Sunscreen
ROUND LAB BIRCH JUICE MILD-UP SUNSCREEN 50ml Special Set (Special Gift: Cleanser 20mL),ROUND LAB,https://global.oliveyoung.com/product/detail?prdtNo=GA220313898,4.5,US$21.00,Face Sunscreen
ROUND LAB Birch Juice Moisturizing Soothing Gel 150mL,ROUND LAB,https://global.oliveyoung.com/product/detail?prdtNo=GA220213757,4.6,US$12.37,Face Sunscreen
Torriden DIVE IN Mild Suncream 60mL,Torriden,https://global.oliveyoung.com/product/detail?prdtNo=GA220213662,4.5,US$29.00,Face Sunscreen
Dr. Orga Premium Sun Protection Cream Special Set (60mL+30mL),DR.Orga,https://global.oliveyoung.com/product/detail?prdtNo=GA220213622,4.5,US$44.00,Face Sunscreen
beplain Cicaful Calming Gel 80mL,beplain,https://global.oliveyoung.com/product/detail?prdtNo=GA210911787,4.6,US$13.30,Face Sunscreen
rom&nd Zero Sun Clean 50ml (Tone Up / Fresh),rom&nd,https://global.oliveyoung.com/product/detail?prdtNo=GA210811493,4.4,US$19.00,Face Sunscreen
Dr. Orga 100 Sun Cream 50mL + 30mL Special Offer,DR.Orga,https://global.oliveyoung.com/product/detail?prdtNo=GA210711137,4.7,US$29.60,Face Sunscreen
ILLIYOON Mild Easy Wash Sun Cream 150mL,ILLIYOON,https://global.oliveyoung.com/product/detail?prdtNo=GA210711079,4.3,US$24.46,Face Sunscreen
YADAH Cactus Soothing Gel 500mL,Yadah,https://global.oliveyoung.com/product/detail?prdtNo=GA210610851,4.9,US$17.00,Face Sunscreen
Dr. Orga 100 Sun Cream SPF50+ PA+++ 50ml,DR.Orga,https://global.oliveyoung.com/product/detail?prdtNo=GA210610743,4.2,US$37.00,Face Sunscreen
SNP UV Perfect Air-Cool Sun Cream 50ml 1+1 Set,SNP,https://global.oliveyoung.com/product/detail?prdtNo=GA210610722,4.6,US$19.20,Face Sunscreen
HYGGEE Vegan Sun Cream 2-for-1 Special Set,HYGGEE,https://global.oliveyoung.com/product/detail?prdtNo=GA210510413,4.7,US$17.77,Face Sunscreen
ma:nyo Real Aloe Soothing Gel 200ml 2-for-1 Set,ma:nyo,https://global.oliveyoung.com/product/detail?prdtNo=GA210003146,4.8,US$11.70,Face Sunscreen
DR.Orga Premium Sun Protection Cream 60ml,DR.Orga,https://global.oliveyoung.com/product/detail?prdtNo=GA210003030,4.6,US$26.40,Face Sunscreen
Avene Beauty Protect Sunscreen SPF50+/PA++++ 30ml,Avene,https://global.oliveyoung.com/product/detail?prdtNo=GA210002646,4.5,US$22.40,Face Sunscreen
9wishes Sun Moisturizer SPF50+/PA+++ 50ml,9wishes,https://global.oliveyoung.com/product/detail?prdtNo=GA210002051,4.3,US$18.20,Face Sunscreen
d'Alba Waterfull Essence Sun Cream 50ml,d'Alba,https://global.oliveyoung.com/product/detail?prdtNo=GA210001978,4.8,US$40.00,Face Sunscreen
Dashu Daily Light Fit Sun Gel 50ml,DASHU,https://global.oliveyoung.com/product/detail?prdtNo=GA210000786,4.7,US$18.25,Face Sunscreen
COSRX Aloe Soothing Sun Cream SPF50+,COSRX,https://global.oliveyoung.com/product/detail?prdtNo=GA210000531,4.7,US$16.00,Face Sunscreen
AROMATICA Soothing Aloe Vera Gel 300ml,AROMATICA,https://global.oliveyoung.com/product/detail?prdtNo=GA210000096,4.8,US$12.00,Face Sunscreen
CAREZONE Daily & Family Sun Care Cream SPF50+,MINIC,https://global.oliveyoung.com/product/detail?prdtNo=GA210000002,5.0,US$15.48,Face Sunscreen
d'Alba Waterfull Essence Sun Cream Duo (50mL + 50mL),d'Alba,https://global.oliveyoung.com/product/detail?prdtNo=GA230217713,4.8,US$47.20,Face Sunscreen
[GOOLYGOOLY EDITION] JUNGSAEMMOOL Kids Mild Sun Cushion 18g Set (+Cleansing Tissue 10P),JUNGSAEMMOOL,https://global.oliveyoung.com/product/detail?prdtNo=GA250530595,,US$41.00,Face Sunscreen
[NUNUSSI EDITION] ROUND LAB Birch Juice Moisturizing Sunscreen 40ml Triple Set,ROUND LAB,https://global.oliveyoung.com/product/detail?prdtNo=GA250530863,4.9,US$35.00,Face Sunscreen
FATION Nosca9 Trouble Comfort Moisture Sun Cream 40ml*2ea Set,FATION,https://global.oliveyoung.com/product/detail?prdtNo=GA250329390,4.6,US$30.50,Face Sunscreen
OBge Pore Zero Oil Control Sun Stick 18g Set (+Pore Zero Lotion 20ml),OBge,https://global.oliveyoung.com/product/detail?prdtNo=GA250732232,,US$21.92,Face Sunscreen
espoir Water Splash Sun Cream Ceramide 60ml Set (+Cleansing Foam 20ml),espoir,https://global.oliveyoung.com/product/detail?prdtNo=GA250732086,,US$20.80,Face Sunscreen
makeprem Hyal Water-Fit Sun Cream 100ml,makeprem,https://global.oliveyoung.com/product/detail?prdtNo=GA250732083,,US$23.56,Face Sunscreen
dewdap Cicatea Mild Tone Up Sun Cream 50ml,dewdap,https://global.oliveyoung.com/product/detail?prdtNo=GA250732080,,US$16.31,Face Sunscreen
Eyelenol Natural Makeup Sun Cream 3.0 50ml,Eyelenol,https://global.oliveyoung.com/product/detail?prdtNo=GA250731925,,US$21.83,Face Sunscreen
Genabelle PDRN Dewy Tone-Up Sunscreen 40ml,Genabelle,https://global.oliveyoung.com/product/detail?prdtNo=GA250631828,,US$23.45,Face Sunscreen
Dr. Althea Aqua Glowing Sunscreen 45ml,Dr. Althea,https://global.oliveyoung.com/product/detail?prdtNo=GA250631825,,US$21.75,Face Sunscreen
UIQ Biome Remedy Mini Tone-up Sun Cushion Purple,UIQ,https://global.oliveyoung.com/product/detail?prdtNo=GA250631822,,US$15.30,Face Sunscreen
UIQ Biome Remedy Mini Tone-up Sun Cushion Green,UIQ,https://global.oliveyoung.com/product/detail?prdtNo=GA250631821,,US$15.30,Face Sunscreen
easydew Mela B Toning Clear UV Sun Patch 4 Servings,easydew,https://global.oliveyoung.com/product/detail?prdtNo=GA250631815,,US$29.04,Face Sunscreen
[TANNING POMPOMPURIN EDITION] BRINGGREEN Aloe 97% Soothing Gel 300ml*2ea,BRINGGREEN,https://global.oliveyoung.com/product/detail?prdtNo=GA250631435,5.0,US$13.30,Face Sunscreen
[TANNING MY MELODY EDITION] Blemish Toning Sunscreen 35ml*3ea,Cell Fusion C,https://global.oliveyoung.com/product/detail?prdtNo=GA250631430,4.2,US$29.68,Face Sunscreen
[TANNING MY MELODY EDITION] Cell Fusion C Aquatica Cooling Sunscreen 35ml*3ea,Cell Fusion C,https://global.oliveyoung.com/product/detail?prdtNo=GA250631429,4.6,US$26.37,Face Sunscreen
[TANNING MY MELODY EDITION] Cell Fusion C Laser UV Sunscreen 35ml*3ea (+Summer Towel),Cell Fusion C,https://global.oliveyoung.com/product/detail?prdtNo=GA250631428,4.8,US$27.17,Face Sunscreen
UIQ Biome Remedy Tone Up Sun Cream Purple 50ml Set (+Watery Sun Cream 20ml),UIQ,https://global.oliveyoung.com/product/detail?prdtNo=GA250531077,,US$25.60,Face Sunscreen
UIQ Biome Remedy Watery Sun Cream 50ml Set (+Purple Tone Up Sun Cream 20ml),UIQ,https://global.oliveyoung.com/product/detail?prdtNo=GA250531076,,US$32.00,Face Sunscreen
Briall Homme Daily Whitening Sun Cream 50ml,Briall Homme,https://global.oliveyoung.com/product/detail?prdtNo=GA250531066,,US$16.91,Face Sunscreen
THE WHOO UV Ultimate Sun Stick 7g,THE WHOO,https://global.oliveyoung.com/product/detail?prdtNo=GA250531064,,US$39.95,Face Sunscreen
THE WHOO UV Ultimate Red Vitamin Sunscreen 50ml,THE WHOO,https://global.oliveyoung.com/product/detail?prdtNo=GA250531063,,US$66.30,Face Sunscreen
INNISFREE Green Tea Hyaluronic Sun Serum 50ml,INNISFREE,https://global.oliveyoung.com/product/detail?prdtNo=GA250530820,,US$26.68,Face Sunscreen
[DISNEY EDITION] goodal Heartleaf Claming Mineral Filter Sun Cream 50ml 1+1 Set,goodal,https://global.oliveyoung.com/product/detail?prdtNo=GA250530809,4.8,US$21.00,Face Sunscreen
[DISNEY EDITION] goodal Heartleaf Calming Moisture Sun Cream 50ml 1+1 Set,goodal,https://global.oliveyoung.com/product/detail?prdtNo=GA250530808,4.8,US$21.00,Face Sunscreen
[GOOLYGOOLY EDITION] JUNGSAEMMOOL Kids Mild Sun Cushion 18g,JUNGSAEMMOOL,https://global.oliveyoung.com/product/detail?prdtNo=GA250530594,,US$35.00,Face Sunscreen
CHASIN' RABBITS All About Glow Cover Cream 35g,CHASIN' RABBITS,https://global.oliveyoung.com/product/detail?prdtNo=GA250430269,,US$19.20,Face Sunscreen
Franz Naked Sunshield EGF Patch 7 Servings,Franz,https://global.oliveyoung.com/product/detail?prdtNo=GA250430218,,US$37.00,Face Sunscreen
OBge Pore Zero Oil Control Sun Stick 18g,OBge,https://global.oliveyoung.com/product/detail?prdtNo=GA250430215,,US$21.95,Face Sunscreen
KAHI Han-Gyob Tone Up Sun Skin #Beige 40ml,KAHI,https://global.oliveyoung.com/product/detail?prdtNo=GA250430213,,US$27.75,Face Sunscreen
KAHI Han-Gyob Tone Up Sun Skin #Purple 40ml,KAHI,https://global.oliveyoung.com/product/detail?prdtNo=GA250430212,,US$27.75,Face Sunscreen
KAHI Han-Gyob Tone Up Sun Skin #Green 40ml,KAHI,https://global.oliveyoung.com/product/detail?prdtNo=GA250430211,,US$27.75,Face Sunscreen
KAHI Velvet Glow Sun Stick 13.5g,KAHI,https://global.oliveyoung.com/product/detail?prdtNo=GA250430210,,US$21.09,Face Sunscreen
Dinsee Premium Vegan Blue Tone Up Sunscreen SPF50+ PA++++ 50ml,Dinsee,https://global.oliveyoung.com/product/detail?prdtNo=GA250430141,5.0,US$17.50,Face Sunscreen
Cell Fusion C Dark Spot Toning Sunscreen 35ml 2 trial Set (+1.2ml 14ea),Cell Fusion C,https://global.oliveyoung.com/product/detail?prdtNo=GA250430115,4.7,US$29.68,Face Sunscreen
Cell Fusion C Aquatica Cooling Sunscreen 35ml*2 trial SET (+1.2ml 14ea),Cell Fusion C,https://global.oliveyoung.com/product/detail?prdtNo=GA250430114,4.8,US$26.37,Face Sunscreen
[Strict MARU EDITION] athe Vegan Relief Sun Cream SPF50+ PA++++ 50ml Set (+35ml+MARU Sun Cushion Case),athe,https://global.oliveyoung.com/product/detail?prdtNo=GA250430096,4.7,US$32.00,Face Sunscreen
Scinic UV Expert Repair Sun Essence SPF50+ PA++++ 50ml,Scinic,https://global.oliveyoung.com/product/detail?prdtNo=GA250329735,5.0,US$28.00,Face Sunscreen
THE SAEM UV Perfection Poreless Tone Up Sun Cream 50ml 1+1 Set,THE SAEM,https://global.oliveyoung.com/product/detail?prdtNo=GA250329691,,US$24.50,Face Sunscreen
Shingmulnara Watery Sun Gel 80ml (+Sun Gel 60ml),Shingmulnara,https://global.oliveyoung.com/product/detail?prdtNo=GA250329674,5.0,US$34.00,Face Sunscreen
Shingmulnara Light Watery Sun Gel 60ml*2ea,Shingmulnara,https://global.oliveyoung.com/product/detail?prdtNo=GA250329673,4.7,US$17.90,Face Sunscreen
AGE 20’s Glow-Fit Tone Up Sun Pact 12.5g Refill Set,AGE 20's,https://global.oliveyoung.com/product/detail?prdtNo=GA250329663,,US$29.60,Face Sunscreen
NIVEA UV Face Young-Age Q10 Sun Cream 50ml,NIVEA,https://global.oliveyoung.com/product/detail?prdtNo=GA250329409,,US$19.00,Face Sunscreen
BEYOND Angel Aqua All Care Moisture Sun Cream 50ml Double Pack,BEYOND,https://global.oliveyoung.com/product/detail?prdtNo=GA250329209,4.0,US$17.85,Face Sunscreen
NIVEA Sun Sensitive Face Sun Cream 50ml,NIVEA,https://global.oliveyoung.com/product/detail?prdtNo=GA250329203,,US$19.00,Face Sunscreen
PURCELL Pixcell Biom UV Moisturizer 40ml,PURCELL,https://global.oliveyoung.com/product/detail?prdtNo=GA250329202,,US$24.59,Face Sunscreen
ANESSA Day Serum N 30ml,ANESSA,https://global.oliveyoung.com/product/detail?prdtNo=GA250329201,,US$45.90,Face Sunscreen
ANESSA Perfect UV Sunscreen Skincare Milk 60ml Set (+12ml*2ea),ANESSA,https://global.oliveyoung.com/product/detail?prdtNo=GA250228798,5.0,US$36.55,Face Sunscreen
[Teenieping EDITION] goodal Heartleaf Calming Moisture Sun Cream 50ml 1+1 Set,goodal,https://global.oliveyoung.com/product/detail?prdtNo=GA250228695,4.9,US$21.00,Face Sunscreen
ALLIE Chrono Beauty Gel UV EXP Sun Cream 40g,ALLIE,https://global.oliveyoung.com/product/detail?prdtNo=GA250228498,,US$12.60,Face Sunscreen
Dewytree Urban Shade Derma Panthenol 5 Moisture Barrier Sun 40ml,Dewytree,https://global.oliveyoung.com/product/detail?prdtNo=GA250228494,,US$19.25,Face Sunscreen
ARZTIN Airy Toning Sun Cream 60ml,ARZTIN,https://global.oliveyoung.com/product/detail?prdtNo=GA250228487,,US$30.91,Face Sunscreen
ARZTIN Airy Water Sun Cream 60ml,ARZTIN,https://global.oliveyoung.com/product/detail?prdtNo=GA250228486,,US$30.91,Face Sunscreen
Portré Water Veil Sun Cream 50ml,Portré,https://global.oliveyoung.com/product/detail?prdtNo=GA250127743,,US$35.15,Face Sunscreen
HEYBRO Water Max Sun Gel 75ml,HEYBRO,https://global.oliveyoung.com/product/detail?prdtNo=GA241227448,,US$18.35,Face Sunscreen
FROMRIER EGF Cica Water Sun Ampoule 56ml Double Set,FROMRIER,https://global.oliveyoung.com/product/detail?prdtNo=GA241227029,,US$42.68,Face Sunscreen
UGLY LOVELY Melon Tone-Up Sunscreen 50ml,UGLY LOVELY,https://global.oliveyoung.com/product/detail?prdtNo=GA241126772,4.0,US$24.00,Face Sunscreen
Bodiance Miracle Relief Face & Body Calming Sun Lotion 300ml,Bodiance,https://global.oliveyoung.com/product/detail?prdtNo=GA241126756,5.0,US$33.00,Face Sunscreen
LBB All Day Air-Fit Sunscreen 50ml,LBB,https://global.oliveyoung.com/product/detail?prdtNo=GA241026503,5.0,US$39.20,Face Sunscreen
picore DIFFERENSEA Blue Biome Repair Sun Protector 40ml,picore,https://global.oliveyoung.com/product/detail?prdtNo=GA241026486,,US$24.44,Face Sunscreen
BENTON Skin Fit Mineral Sun Cream 50ml,BENTON,https://global.oliveyoung.com/product/detail?prdtNo=GA240925635,5.0,US$17.03,Face Sunscreen
Te' Chorok 35 Tone Up Daily Mineral Sun Cushion 14g,Te',https://global.oliveyoung.com/product/detail?prdtNo=GA240925612,4.0,US$34.11,Face Sunscreen
BENTON Cica Gel Sunscreen Serum 50ml,BENTON,https://global.oliveyoung.com/product/detail?prdtNo=GA240825497,5.0,US$22.00,Face Sunscreen
The Harnay Cicaide Mild Sun Care 50ml+50ml Set,The Harnay,https://global.oliveyoung.com/product/detail?prdtNo=GA240825477,5.0,US$28.05,Face Sunscreen
Eyelenol Natural Makeup Sun Cream 2.0 50ml,Eyelenol,https://global.oliveyoung.com/product/detail?prdtNo=GA240825015,4.2,US$21.83,Face Sunscreen
BRINGGREEN Aloe 99% Soothing Gel 300ml Double Pack,BRINGGREEN,https://global.oliveyoung.com/product/detail?prdtNo=GA240724890,4.7,US$13.52,Face Sunscreen
Shingmulnara Water Light Sun Gel Lotion Large Capacity Edition (60ml + 80ml),Shingmulnara,https://global.oliveyoung.com/product/detail?prdtNo=GA240724861,4.9,US$34.00,Face Sunscreen
SKIN1004 Madagascar Centella Hyalu-Cica Water-Fit Sun Serum 100mL,SKIN1004,https://global.oliveyoung.com/product/detail?prdtNo=GA240724745,4.9,US$22.10,Face Sunscreen
A’pieu Pure Block Natural Daily Sun Cream EX 50ml,A'pieu,https://global.oliveyoung.com/product/detail?prdtNo=GA240724681,,US$9.60,Face Sunscreen
A’pieu Pure Block Natural Water Proof Sun Cream 50ml,A'pieu,https://global.oliveyoung.com/product/detail?prdtNo=GA240724679,,US$9.60,Face Sunscreen
A’pieu Pure Block Tone-Up Sun Base EX 50ml,A'pieu,https://global.oliveyoung.com/product/detail?prdtNo=GA240724671,4.4,US$9.60,Face Sunscreen
Anua Heartleaf Silky Moisture Sun Cream 50ml Double Pack,Anua,https://global.oliveyoung.com/product/detail?prdtNo=GA240724500,5.0,US$41.00,Face Sunscreen
Derma B Everyday Sun Block 200ml,Derma B,https://global.oliveyoung.com/product/detail?prdtNo=GA240623950,4.7,US$22.00,Face Sunscreen
RAWQUEST Barrier Enhancing Sun Cream 50ml,RAWQUEST,https://global.oliveyoung.com/product/detail?prdtNo=GA240623948,,US$29.00,Face Sunscreen
Bushman Waterproof Pro Sun Cream 50g Set (+Daily Sun Cream 20ml),Bushman,https://global.oliveyoung.com/product/detail?prdtNo=GA240523811,,US$19.60,Face Sunscreen
Bushman Sea Friendly Bronze Taning Oil 190ml Set (+Daily Sun Cream 20ml),Bushman,https://global.oliveyoung.com/product/detail?prdtNo=GA240523809,5.0,US$31.38,Face Sunscreen
DEAR DAHLIA Sun Breeze Essential Sun Serum 50ml,DEAR DAHLIA,https://global.oliveyoung.com/product/detail?prdtNo=GA240523792,5.0,US$24.50,Face Sunscreen
AHC Masters Calming Waterfull Sun Stick 22g,AHC,https://global.oliveyoung.com/product/detail?prdtNo=GA240523778,4.6,US$19.60,Face Sunscreen
BRINGGREEN Aloe 99% Soothing Gel 300ml,BRINGGREEN,https://global.oliveyoung.com/product/detail?prdtNo=GA240523742,4.7,US$8.00,Face Sunscreen
[Oyo-collabration] round around Comfort Green Tea Tone Up Sunscreen 50mL 1+1 Special Set,round around,https://global.oliveyoung.com/product/detail?prdtNo=GA240523741,4.6,US$31.00,Face Sunscreen
EDIT.B Sunday Tone Up Sun Serum 55ml SPF50+ PA++++,EDIT.B,https://global.oliveyoung.com/product/detail?prdtNo=GA240523603,5.0,US$16.00,Face Sunscreen
PHYSIOGEL Cica Balance Pore Solution Sunscreen 30ml,PHYSIOGEL,https://global.oliveyoung.com/product/detail?prdtNo=GA240423264,5.0,US$41.00,Face Sunscreen
AMUSE Beige Tone-Up 365 Vegan Sunscreen 40mL,AMUSE,https://global.oliveyoung.com/product/detail?prdtNo=GA240423108,4.3,US$31.00,Face Sunscreen
INNISFREE Green Tea Hyaluronic Moist Sun Serum 50ml,INNISFREE,https://global.oliveyoung.com/product/detail?prdtNo=GA240423101,4.5,US$26.68,Face Sunscreen
ETUDE Soonjung Director's Tone-up Correcting Sun Cream 40mL,ETUDE,https://global.oliveyoung.com/product/detail?prdtNo=GA240423100,4.4,US$23.08,Face Sunscreen
shaishaishai Positive Sun Tanning Watery Cream 110mL SPF22,shaishaishai,https://global.oliveyoung.com/product/detail?prdtNo=GA240322830,5.0,US$20.65,Face Sunscreen
TOXNFILL Sunblock 50mL,TOXNFILL,https://global.oliveyoung.com/product/detail?prdtNo=GA240322608,4.2,US$33.00,Face Sunscreen
ETUDE Soonjung Director's Tone-UP Correcting Sun Cream 40mL Special Set (+20mL),ETUDE,https://global.oliveyoung.com/product/detail?prdtNo=GA240322603,4.0,US$23.08,Face Sunscreen
BRINGGREEN Bamboo Hyalu Watery Sun Cream 50mL,BRINGGREEN,https://global.oliveyoung.com/product/detail?prdtNo=GA240322580,5.0,US$24.00,Face Sunscreen
BRINGGREEN Bamboo Hyalu Watery Sun Cream 50mL 1+1 Special Set,BRINGGREEN,https://global.oliveyoung.com/product/detail?prdtNo=GA240322579,4.6,US$24.00,Face Sunscreen
makeprem Soothing Pink Tone Up Sun Cream 40mL 1+1 Special Set,makeprem,https://global.oliveyoung.com/product/detail?prdtNo=GA240322571,4.5,US$27.41,Face Sunscreen
round around Comfort Green Tea Air Sunstick 19g Double Set,round around,https://global.oliveyoung.com/product/detail?prdtNo=GA240322562,4.8,US$42.00,Face Sunscreen
round around Comfort Green Tea Air Sunstick 19g+Comfort Green Tea Purifying Cleansing Foam 30mL Special Set,round around,https://global.oliveyoung.com/product/detail?prdtNo=GA240322561,5.0,US$26.00,Face Sunscreen
round around Comfort Green Tea Tone Up Sunscreen 50mL 1+1 Special Set,round around,https://global.oliveyoung.com/product/detail?prdtNo=GA240322557,4.4,US$20.15,Face Sunscreen
Dinsee Premium Vegan 3 in 1 Sunscreen Stick SPF50+ PA++++ 10.5g,Dinsee,https://global.oliveyoung.com/product/detail?prdtNo=GA240322547,4.5,US$51.00,Face Sunscreen
espoir Water Splash Sun Cream Fresh Cica 60mL Double Set,espoir,https://global.oliveyoung.com/product/detail?prdtNo=GA240322468,4.9,US$32.25,Face Sunscreen
AGE 20's Skin-Fit Hydra Sun Cream+ 50mL,AGE 20's,https://global.oliveyoung.com/product/detail?prdtNo=GA240222358,5.0,US$18.60,Face Sunscreen
AGE 20's Sun Essence Pact Calming Long Protection 12.5g Refill Set,AGE 20's,https://global.oliveyoung.com/product/detail?prdtNo=GA240222357,5.0,US$29.60,Face Sunscreen
FUSIDYNE Derma Trouble Zinc Calming Sun Cream 50mL 1+1 Special Set,FUSIDYNE,https://global.oliveyoung.com/product/detail?prdtNo=GA240222340,,US$27.90,Face Sunscreen
Dewytree Urban Shade Cool Calming Moist Sun 150mL,Dewytree,https://global.oliveyoung.com/product/detail?prdtNo=GA240222335,4.8,US$21.78,Face Sunscreen
Dewytree Urban Shade Blue Tone Up Sun 40g,Dewytree,https://global.oliveyoung.com/product/detail?prdtNo=GA240222334,5.0,US$19.60,Face Sunscreen
ANESSA Perfect UV Sunscreen Skincare Gel 90g,ANESSA,https://global.oliveyoung.com/product/detail?prdtNo=GA240222130,4.9,US$35.00,Face Sunscreen
ANESSA Perfect UV Sunscreen Skincare Milk 60mL,ANESSA,https://global.oliveyoung.com/product/detail?prdtNo=GA240222129,5.0,US$43.00,Face Sunscreen
ANESSA Brightening UV Sunscreen Gel 90g,ANESSA,https://global.oliveyoung.com/product/detail?prdtNo=GA240222127,4.3,US$35.00,Face Sunscreen
Shingmulnara White Rice Bright Tone Sun Gel Lotion 60mL,Shingmulnara,https://global.oliveyoung.com/product/detail?prdtNo=GA240222124,4.8,US$16.78,Face Sunscreen
rataplan Water Parsley Calming Sun Cream 50mL 1+1 Special Set,rataplan,https://global.oliveyoung.com/product/detail?prdtNo=GA240121915,5.0,US$27.72,Face Sunscreen
shaishaishai Positive Sun Tanning Watery Cream SPF22 150mL,shaishaishai,https://global.oliveyoung.com/product/detail?prdtNo=GA230619399,4.0,US$26.86,Face Sunscreen
Green Finger Forest Multi Defense Sun Stick 19g,Green Finger,https://global.oliveyoung.com/product/detail?prdtNo=GA230619382,5.0,US$26.00,Face Sunscreen
asis-tobe Green Tea Moisture Sun Block 50mL,ASIS-TOBE,https://global.oliveyoung.com/product/detail?prdtNo=GA230619128,5.0,US$19.60,Face Sunscreen
PURE MELLOW Daily Tone Up Moisture Sun Cream 50g,PURE MELLOW,https://global.oliveyoung.com/product/detail?prdtNo=GA230619017,4.0,US$9.57,Face Sunscreen
TONEfitSUN Vegan No Sebum Sun Stick (Waterproof/Primer) (SPF50+/PA++++),TONEfitSUN,https://global.oliveyoung.com/product/detail?prdtNo=GA230619016,5.0,US$20.00,Face Sunscreen
AXIS-Y Complete No-Stress Physical Sunscreen 50mL,AXIS-Y,https://global.oliveyoung.com/product/detail?prdtNo=GA230518757,4.5,US$18.48,Face Sunscreen
Color Labs 100X White Tanning Ampoule 30mL,Color Labs,https://global.oliveyoung.com/product/detail?prdtNo=GA230518557,4.7,US$37.00,Face Sunscreen
JUNGSAEMMOOL Mild Sun Stick 17g,JUNGSAEMMOOL,https://global.oliveyoung.com/product/detail?prdtNo=GA230518556,,US$29.00,Face Sunscreen
belif Happy Bo Sun Metal Cushion 15g,belif,https://global.oliveyoung.com/product/detail?prdtNo=GA230518548,5.0,US$28.00,Face Sunscreen
DERMAFIRM Soothing Repair Toning Sun Cream R4 40g,DERMAFIRM,https://global.oliveyoung.com/product/detail?prdtNo=GA230418328,5.0,US$25.20,Face Sunscreen
Green Finger Forest Watery Essence Sun Cream 80mL,Green Finger,https://global.oliveyoung.com/product/detail?prdtNo=GA230418168,4.7,US$18.67,Face Sunscreen
[NEW] Abib Heartleaf Sun Essence Calming Drop 50mL,Abib,https://global.oliveyoung.com/product/detail?prdtNo=GA230418136,4.4,US$25.00,Face Sunscreen
espoir Water Splash Sun Cream Fresh CICA 60mL SPF50+ PA++++,espoir,https://global.oliveyoung.com/product/detail?prdtNo=GA230418125,4.6,US$21.25,Face Sunscreen
Dr.ato Moisture Daily Sun Protecter 50mL,Dr.ato,https://global.oliveyoung.com/product/detail?prdtNo=GA230318002,4.5,US$15.19,Face Sunscreen
[OY Exclusive] Acnes Blemish Calming Sun Cream 50mL 1+1 Special Set,Acnes,https://global.oliveyoung.com/product/detail?prdtNo=GA230317864,4.2,US$24.70,Face Sunscreen
[Tone Up] athe Vegan Relief Tone Up Sun BB 50mL,athe,https://global.oliveyoung.com/product/detail?prdtNo=GA230217671,5.0,US$28.00,Face Sunscreen
[Tone Up] athe Vegan Relief Tone Up Sun BB 50mL 1+1 Special Set,athe,https://global.oliveyoung.com/product/detail?prdtNo=GA230217667,,US$35.17,Face Sunscreen
SKINFOOD Berry Soothing Sun Cream 50mL SPF50+ PA++++,SKINFOOD,https://global.oliveyoung.com/product/detail?prdtNo=GA230217589,4.5,US$27.00,Face Sunscreen
Cure Aloe Soothing Gel Renewed 150mL 1+1 Special Set,Cure,https://global.oliveyoung.com/product/detail?prdtNo=GA220916325,4.9,US$11.87,Face Sunscreen
BRINGGREEN Aloe 99% Soothing Gel Double Pack (300mL*2ea),BRINGGREEN,https://global.oliveyoung.com/product/detail?prdtNo=GA220815870,4.7,US$16.00,Face Sunscreen
ROUND LAB Birch Juice Moisturizing Sunscreen 50ml 1+1 Special Set,ROUND LAB,https://global.oliveyoung.com/product/detail?prdtNo=GA220815784,4.9,US$30.00,Face Sunscreen
Dr.Different Double Defense Sunblock 40mL,Dr.Different,https://global.oliveyoung.com/product/detail?prdtNo=GA220715387,5.0,US$27.75,Face Sunscreen
SKIN1004 Madagascar Centella Air-Fit Sun Cream Light 50mL,SKIN1004,https://global.oliveyoung.com/product/detail?prdtNo=GA220715345,4.5,US$14.45,Face Sunscreen
MARY&MAY Cica Soothing Sun Cream SPF50+ PA++++ 50mL,Mary&May,https://global.oliveyoung.com/product/detail?prdtNo=GA220715310,4.5,US$15.26,Face Sunscreen
LABIOTTE UV Veil Moisture Sun Essence Special Set (50mL+20mL),labiotte,https://global.oliveyoung.com/product/detail?prdtNo=GA220615191,4.3,US$21.70,Face Sunscreen
HOLIKA HOLIKA Make Up Sun Cream 60mL,Holika Holika,https://global.oliveyoung.com/product/detail?prdtNo=GA220414678,4.0,US$13.00,Face Sunscreen
HOLIKA HOLIKA Moisture Make Up Sun Cream 60mL,Holika Holika,https://global.oliveyoung.com/product/detail?prdtNo=GA220414677,4.6,US$16.00,Face Sunscreen
d'Alba Waterfull Mild Sun Cream 50mL,d'Alba,https://global.oliveyoung.com/product/detail?prdtNo=GA220414397,4.4,US$28.00,Face Sunscreen
BRINGGREEN Tea Tree Cica Tone Up Sun Cushion 15g,BRINGGREEN,https://global.oliveyoung.com/product/detail?prdtNo=GA220213645,4.6,US$24.00,Face Sunscreen
BRINGGREEN Tea Tree Cica Cooling Sun Stick 22g,BRINGGREEN,https://global.oliveyoung.com/product/detail?prdtNo=GA220213644,4.6,US$24.00,Face Sunscreen
BRINGGREEN Tea Tree Cica Soothing Sun Cream 50mL,BRINGGREEN,https://global.oliveyoung.com/product/detail?prdtNo=GA220213643,4.6,US$24.00,Face Sunscreen
Dewytree Urban Shade Cover & Fit Sun Cushion 14g,Dewytree,https://global.oliveyoung.com/product/detail?prdtNo=GA220213626,4.2,US$18.20,Face Sunscreen
VELY VELY Collagen Sun Serum 30ml,VELY VELY,https://global.oliveyoung.com/product/detail?prdtNo=GA210811676,4.5,US$29.00,Face Sunscreen
allNATURAL Houttuynia Cordata Daily Calming Gel 100mL,all natural,https://global.oliveyoung.com/product/detail?prdtNo=GA210711134,5.0,US$16.00,Face Sunscreen
Shingmulnara Oxygen Water Face & Body Sun Stick SPF50+PA++++,Shingmulnara,https://global.oliveyoung.com/product/detail?prdtNo=GA210510393,4.6,US$20.00,Face Sunscreen
BRINGGREEN Aloe 99% Soothing Gel 300ml,BRINGGREEN,https://global.oliveyoung.com/product/detail?prdtNo=GA210003065,4.9,US$12.00,Face Sunscreen
Hyggee Fresh Tone-Up Sun Cream 50ml,HYGGEE,https://global.oliveyoung.com/product/detail?prdtNo=GA210003007,4.0,US$25.00,Face Sunscreen
Scinic Enjoy Super Mild Sun Essence 50ml,Scinic,https://global.oliveyoung.com/product/detail?prdtNo=GA210001658,4.8,US$7.78,Face Sunscreen
ROVECTIN Intense Moisture Sunscreen 50ml(SPF50+/PA++++),ROVECTIN,https://global.oliveyoung.com/product/detail?prdtNo=GA210001400,5.0,US$22.10,Face Sunscreen
Scinic Enjoy Perfect Sun Cream SPF50+/PA+++ 50ml,Scinic,https://global.oliveyoung.com/product/detail?prdtNo=GA210000003,4.5,US$7.58,Face Sunscreen
