prdtName,Brand,url,rating-info,price,type
Beauty of Joseon Relief Sun: Rice + Probiotics (SPF50+ PA++++) Double Pack 50mL*2ea,Beauty of Joseon,https://global.oliveyoung.com/product/detail?prdtNo=GA220615265,4.9,US$25.99,Face Sunscreen
SKIN1004 Madagascar Centella Hyalu-Cica Water-Fit Sun Serum 50mL*2ea (Twin pack),SKIN1004,https://global.oliveyoung.com/product/detail?prdtNo=GA230518746,4.9,US$23.80,Face Sunscreen
[TRIPLE] ROUND LAB Birch Juice Moisturizing Sunscreen 50ml Triple Set,ROUND LAB,https://global.oliveyoung.com/product/detail?prdtNo=GA250430113,4.9,US$48.00,Face Sunscreen
Beauty of Joseon Relief Sun Aqua Fresh Rice+B5 50ml*2ea,Beauty of Joseon,https://global.oliveyoung.com/product/detail?prdtNo=GA241227407,4.9,US$25.99,Face Sunscreen
d'Alba Waterful Tone Up Sun Cream Purple 50mL Duo Set,d'Alba,https://global.oliveyoung.com/product/detail?prdtNo=GA240222109,4.7,US$41.30,Face Sunscreen
ROUND LAB Birch Juice Moisturizing Sun Stick 19g Double Set,ROUND LAB,https://global.oliveyoung.com/product/detail?prdtNo=GA240322554,4.8,US$27.99,Face Sunscreen
d'Alba Waterfull Tone-Up Sun Cream Duo Set (50mL+50mL),d'Alba,https://global.oliveyoung.com/product/detail?prdtNo=GA220414400,4.7,US$59.00,Face Sunscreen
ROUND LAB BIRCH JUICE MOISTURIZING SUNSCREEN 50ml Set,ROUND LAB,https://global.oliveyoung.com/product/detail?prdtNo=GA210004685,4.8,US$20.28,Face Sunscreen
SKIN1004 Perfect Suncare Kit (Sun serum 50ml+Sun stick 20g+Cleansing oil 30ml+Cleansing Foam 20ml),SKIN1004,https://global.oliveyoung.com/product/detail?prdtNo=GA241126581,4.9,US$24.60,Face Sunscreen
Dr.G Red Blemish Soothing Up Sun 50mL 1+1 Special Set,Dr.G,https://global.oliveyoung.com/product/detail?prdtNo=GA240222102,4.7,US$21.84,Face Sunscreen
AESTURA Derma UV365 Barrier Hydro Mineral Sunscreen 40ml Set (+20ml),AESTURA,https://global.oliveyoung.com/product/detail?prdtNo=GA240624151,4.6,US$32.80,Face Sunscreen
d'Alba Waterfull UV Essene Cover-Up Sun Cream Beige 50ml,d'Alba,https://global.oliveyoung.com/product/detail?prdtNo=GA250631436,,US$27.76,Face Sunscreen
Isntree Hyaluronic Acid Watery Sun Gel Double Set (50mL+50mL),Isntree,https://global.oliveyoung.com/product/detail?prdtNo=GA230920295,4.8,US$31.28,Face Sunscreen
[Duo Set] numbuzin No. 1 Clear Filter Sun Essence SPF50+ PA++++ 50mL + 50mL Duo Set,numbuzin,https://global.oliveyoung.com/product/detail?prdtNo=GA230518528,4.8,US$24.30,Face Sunscreen
Anua Heartleaf Silky Moisture Sun Cream 50mL + 10mL Special Set,Anua,https://global.oliveyoung.com/product/detail?prdtNo=GA230117431,4.8,US$19.90,Face Sunscreen
Beauty of Joseon Relief Sun Aqua-fresh Rice+B5 (SPF50+ PA++++) 50mL,Beauty of Joseon,https://global.oliveyoung.com/product/detail?prdtNo=GA240825222,4.8,US$18.00,Face Sunscreen
INNISFREE Green Tea Hyaluronic Sun Serum 50ml 1+1 Set,INNISFREE,https://global.oliveyoung.com/product/detail?prdtNo=GA250530821,4.9,US$26.68,Face Sunscreen
SKIN1004 Madagascar Centella Hyalu-Cica Water-Fit Sun Serum 50mL,SKIN1004,https://global.oliveyoung.com/product/detail?prdtNo=GA220715346,4.8,US$18.70,Face Sunscreen
Dr.G Green Mild Up Sun+ Special Set,Dr.G,https://global.oliveyoung.com/product/detail?prdtNo=GA230217716,4.6,US$22.95,Face Sunscreen
Beauty of Joseon Ginseng Moist Sun Serum 50mL,Beauty of Joseon,https://global.oliveyoung.com/product/detail?prdtNo=GA230518751,4.5,US$16.80,Face Sunscreen
House of Hur Weightless Sun Fluid 50ml,House of Hur,https://global.oliveyoung.com/product/detail?prdtNo=GA250329724,4.8,US$15.20,Face Sunscreen
AESTURA Derma UV365 Barrier Hydro Mineral Sunscreen 40mL,AESTURA,https://global.oliveyoung.com/product/detail?prdtNo=GA230317843,4.7,US$32.80,Face Sunscreen
Purito Seoul Daily Soft Touch Sunscreen SPF50+ PA++++ 60mL,Purito Seoul,https://global.oliveyoung.com/product/detail?prdtNo=GA240624170,4.9,US$17.60,Face Sunscreen
[Duo Set] numbuzin No. 3 Porcelain Base-skip Tone Up Beige SPF50+ PA++++ 35mL + 35mL Duo Set,numbuzin,https://global.oliveyoung.com/product/detail?prdtNo=GA230518530,4.5,US$21.60,Face Sunscreen
ANESSA Perfect UV Sunscreen Skincare Milk 60ml Set (+12ml*Keyring),ANESSA,https://global.oliveyoung.com/product/detail?prdtNo=GA250530860,,US$38.70,Face Sunscreen
Dr.G Vita Clear Sun Serum 50ml,Dr.G,https://global.oliveyoung.com/product/detail?prdtNo=GA250329210,4.8,US$20.23,Face Sunscreen
beauty of joseon Matte sun stick : Mugwort + Camelia Double Pack,Beauty of Joseon,https://global.oliveyoung.com/product/detail?prdtNo=GA240825347,4.8,US$27.00,Face Sunscreen
Dr.G Brightening Up Sun+ Special Set,Dr.G,https://global.oliveyoung.com/product/detail?prdtNo=GA230217717,4.8,US$24.47,Face Sunscreen
Isntree Hyaluronic Acid Watery Sun Gel 50mL,Isntree,https://global.oliveyoung.com/product/detail?prdtNo=GA220815815,4.8,US$18.30,Face Sunscreen
O HUI 3 Hour Blurring Sun Powder 20g,O HUI,https://global.oliveyoung.com/product/detail?prdtNo=GA250430214,4.8,US$50.40,Face Sunscreen
espoir Water Splash Sun Cream Ceramide 60mL + 20mL Special Set,espoir,https://global.oliveyoung.com/product/detail?prdtNo=GA230117432,4.7,US$19.20,Face Sunscreen
[Large Size] AHC Masters Air Rich Sun Stick 22g,AHC,https://global.oliveyoung.com/product/detail?prdtNo=GA230418182,4.8,US$19.00,Face Sunscreen
MEDIHEAL Madecassoside Moisture Sun Serum Blemish Repair 50g,MEDIHEAL,https://global.oliveyoung.com/product/detail?prdtNo=GA250329661,4.8,US$18.98,Face Sunscreen
Purito Seoul Daily Soft Touch Sunscreen SPF50+ PA++++ 60mL Duo,Purito Seoul,https://global.oliveyoung.com/product/detail?prdtNo=GS250832677,4.9,US$31.50,Face Sunscreen
Shingmulnara Jeju Aloe Cooling Sun Stick 19g Refill Set,Shingmulnara,https://global.oliveyoung.com/product/detail?prdtNo=GA250229036,4.8,US$18.35,Face Sunscreen
[1+1] House of Hur Weightless Sun Fluid 50ml,House of Hur,https://global.oliveyoung.com/product/detail?prdtNo=GS250631495,4.8,US$29.00,Face Sunscreen
ROUND LAB Birch Juice Moisturizing Sun Cushion 15g,ROUND LAB,https://global.oliveyoung.com/product/detail?prdtNo=GA220213759,4.3,US$21.50,Face Sunscreen
makeprem UV Defense Me No Sebum Sun Cream 40mL 1+1 Special Set,makeprem,https://global.oliveyoung.com/product/detail?prdtNo=GA230418270,4.6,US$27.69,Face Sunscreen
Cell Fusion C Stick Sunscreen 100 19g SPF 50+/PA++++,Cell Fusion C,https://global.oliveyoung.com/product/detail?prdtNo=GA210001576,4.7,US$15.95,Face Sunscreen
Cell Fusion C Laser UV Sunscreen 35ml*2 trial SET (+1.2ml 14ea),Cell Fusion C,https://global.oliveyoung.com/product/detail?prdtNo=GA250430116,4.5,US$25.81,Face Sunscreen
COSRX Ultra-Light Invisible Sunscreen 50ml double set,COSRX,https://global.oliveyoung.com/product/detail?prdtNo=GA240925876,4.6,US$24.81,Face Sunscreen
Cell Fusion C Dark Spot Toning Sunscreen 35ml Double Pack,Cell Fusion C,https://global.oliveyoung.com/product/detail?prdtNo=GA250228490,4.7,US$28.19,Face Sunscreen
House of Hur Tropical Dew Sun Cream 50ml,House of Hur,https://global.oliveyoung.com/product/detail?prdtNo=GA250429931,4.8,US$15.20,Face Sunscreen
Neogen Dermalogy Double Vita Watery Sun Serum 50ml,Neogen,https://global.oliveyoung.com/product/detail?prdtNo=GA250228511,5.0,US$23.60,Face Sunscreen
Torriden Dive In Moisture Sunscreen 60ml 1+1 Set (RENEWAL),Torriden,https://global.oliveyoung.com/product/detail?prdtNo=GA250228557,4.7,US$23.08,Face Sunscreen
BIOHEAL BOH Probioderm Collagen Essence Sun Cream 1+1 Special Set,BIOHEAL BOH,https://global.oliveyoung.com/product/detail?prdtNo=GA240322577,4.7,US$22.75,Face Sunscreen
NATURE REPUBLIC California Aloe Cooling Watery Sun Stick 24g,NATURE REPUBLIC,https://global.oliveyoung.com/product/detail?prdtNo=GA250329734,5.0,US$21.00,Face Sunscreen
SNP PDRN + ECTOIN UV Aging Recovery Sun Serum 50ml Set (+20ml),SNP,https://global.oliveyoung.com/product/detail?prdtNo=GA250329566,4.9,US$24.00,Face Sunscreen
LANEIGE Water Bank UV Barrier Sunscreen 50ml Set (+25ml),LANEIGE,https://global.oliveyoung.com/product/detail?prdtNo=GA250228658,4.5,US$33.00,Face Sunscreen
AESTURA Derma UV365 Red Soothing Tone-Up Sunscreen 40ml Set (+20ml),AESTURA,https://global.oliveyoung.com/product/detail?prdtNo=GA240624150,4.6,US$32.80,Face Sunscreen
Cell Fusion C Laser UV Sunscreen 50mL+20mL Special Set,Cell Fusion C,https://global.oliveyoung.com/product/detail?prdtNo=GA240322831,4.5,US$34.00,Face Sunscreen
Shingmulnara Mild Face & Body Sun Cream 150ml,Shingmulnara,https://global.oliveyoung.com/product/detail?prdtNo=GA250229031,4.2,US$14.86,Face Sunscreen
[1+1] House of Hur Tropical Dew Sun Cream 50ml,House of Hur,https://global.oliveyoung.com/product/detail?prdtNo=GS250631496,4.8,US$29.00,Face Sunscreen
Dr. Althea Green Tea Fresh Sunscreen 45ml,Dr. Althea,https://global.oliveyoung.com/product/detail?prdtNo=GA250631826,,US$20.30,Face Sunscreen
Cell Fusion C Laser UV Pore Sun Serum 40ml,Cell Fusion C,https://global.oliveyoung.com/product/detail?prdtNo=GA250430117,4.8,US$20.25,Face Sunscreen
Beauty of Joseon Rice Wonderland Limited Set (Sun 50ml+Toner 150ml+Serum 30ml+Mask 150ml+Mirror),Beauty of Joseon,https://global.oliveyoung.com/product/detail?prdtNo=GA241126903,4.9,US$56.00,Face Sunscreen
Singmulnara Oxygen Water Waterproof Sun Cream_100mL _21,Shingmulnara,https://global.oliveyoung.com/product/detail?prdtNo=GA210510537,4.6,US$12.50,Face Sunscreen
Cell Fusion C Aquatica Cooling Sunscreen 35ml Double Pack,Cell Fusion C,https://global.oliveyoung.com/product/detail?prdtNo=GA250228489,4.9,US$25.05,Face Sunscreen
d'Alba Waterful Tone Up Sun Cushion Duo Set (15g + 15g),d'Alba,https://global.oliveyoung.com/product/detail?prdtNo=GA230619326,4.7,US$48.80,Face Sunscreen
beplain Mung Bean Cooling Moisture Sunscreen (1+1 SET),beplain,https://global.oliveyoung.com/product/detail?prdtNo=GA250228376,4.7,US$24.07,Face Sunscreen
Dr.G Green Mild Up Sun Stick 20g,Dr.G,https://global.oliveyoung.com/product/detail?prdtNo=GA210610742,4.4,US$15.68,Face Sunscreen
mixsoon Centella Sun Cream 50ml Set (+5ml*2ea),mixsoon,https://global.oliveyoung.com/product/detail?prdtNo=GA240724487,4.7,US$22.50,Face Sunscreen
ROUND LAB Camellia Deep Collagen Firming Sun Serum 50ml Set (+7ml),ROUND LAB,https://global.oliveyoung.com/product/detail?prdtNo=GA250128037,4.7,US$22.27,Face Sunscreen
TOCOBO Cotton Soft Sun Stick 19g,TOCOBO,https://global.oliveyoung.com/product/detail?prdtNo=GA230117397,4.8,US$22.00,Face Sunscreen
medicube PDRN Pink Tone Up Sun Cream 50ml Set (+20ml),medicube,https://global.oliveyoung.com/product/detail?prdtNo=GA250429915,4.8,US$21.20,Face Sunscreen
ROUND LAB Camellia Deep Collagen Firming Sun Serum 50ml+50ml Set,ROUND LAB,https://global.oliveyoung.com/product/detail?prdtNo=GA250329208,4.7,US$41.01,Face Sunscreen
primera Repairing Cera-Capsule UV Protector 40mL,Primera,https://global.oliveyoung.com/product/detail?prdtNo=GA240121639,4.8,US$40.00,Face Sunscreen
BRINGGREEN Tea Tree Cica Tone Up Sun Cushion 15g+Refill 15g Set (+Mini Sun Cushion 5g),BRINGGREEN,https://global.oliveyoung.com/product/detail?prdtNo=GA250530596,4.4,US$20.76,Face Sunscreen
Shingmulnara White Rice Bright Tone Up Sun Cushion Refill 2EA Set,Shingmulnara,https://global.oliveyoung.com/product/detail?prdtNo=GA250128367,,US$18.58,Face Sunscreen
Isntree Hyaluronic Acid Natural Sun Cream 50ml (RENEWAL),Isntree,https://global.oliveyoung.com/product/detail?prdtNo=GA250228796,4.4,US$18.38,Face Sunscreen
SKIN1004 Madagascar Centella Tea-Trica Soothing Sun Milk 50ml,SKIN1004,https://global.oliveyoung.com/product/detail?prdtNo=GA240724744,4.7,US$17.00,Face Sunscreen
[Duo Set] Abib Airy Sunstick Smoothing Bar SPF50+,Abib,https://global.oliveyoung.com/product/detail?prdtNo=GS250531190,4.7,US$33.60,Face Sunscreen
[NEW] Abib Airy Sunstick Smoothing Bar SPF50+,Abib,https://global.oliveyoung.com/product/detail?prdtNo=GA230719483,4.7,US$19.60,Face Sunscreen
[NEW] Abib Quick Sun Stick Protection Bar 22g,Abib,https://global.oliveyoung.com/product/detail?prdtNo=GA230418140,4.6,US$33.00,Face Sunscreen
BRINGGREEN Aloe 97% Soothing Gel 300ml Double Pack,BRINGGREEN,https://global.oliveyoung.com/product/detail?prdtNo=GA241227207,4.8,US$16.00,Face Sunscreen
Scinic Enjoy Super Mild Sun Essence Special Set,Scinic,https://global.oliveyoung.com/product/detail?prdtNo=GA210003127,4.8,US$15.59,Face Sunscreen
Lagom Cellus Sungel+ 40mL,Lagom,https://global.oliveyoung.com/product/detail?prdtNo=GA220414574,4.7,US$31.00,Face Sunscreen
[NUNUSSI EDITION] ROUND LAB Birch Juice Moisturizing Sun Stick 19g Double Pack (+Birch Juice Moisturizing Pad 4P),ROUND LAB,https://global.oliveyoung.com/product/detail?prdtNo=GA250530644,4.8,US$30.05,Face Sunscreen
ROUND LAB Birch Juice Moisturizing Tone Up Sun Cream 50mL 1+1 Special Set,ROUND LAB,https://global.oliveyoung.com/product/detail?prdtNo=GA230618993,4.6,US$30.00,Face Sunscreen
ROUND LAB Birch Juice Moisturizing Mild-up Sun Cream 50mL 1+1 Special Set,ROUND LAB,https://global.oliveyoung.com/product/detail?prdtNo=GA220615150,4.8,US$30.00,Face Sunscreen
Arencia Deep Water Surge Sun Serum 50ml 1+1 Set,Arencia,https://global.oliveyoung.com/product/detail?prdtNo=GA250732228,5.0,US$29.70,Face Sunscreen
S.NATURE Aqua 365 UV Sun Protective Cream 40ml Double Pack,S.NATURE,https://global.oliveyoung.com/product/detail?prdtNo=GA240724514,5.0,US$29.04,Face Sunscreen
Beauty of Joseon Matte sun stick : Mugwort + Camelia 18g,Beauty of Joseon,https://global.oliveyoung.com/product/detail?prdtNo=GA230117319,4.6,US$14.40,Face Sunscreen
celimax Brightening Pore + Dark Spot Sunscreen 50ml,celimax,https://global.oliveyoung.com/product/detail?prdtNo=GA250430274,4.6,US$28.00,Face Sunscreen
GOONGBE Fresh Sun Stick Mild 23g,GOONGBE,https://global.oliveyoung.com/product/detail?prdtNo=GA250429918,4.8,US$28.00,Face Sunscreen
Real Barrier Cica Green Tone-Up Sun Cream 50mL 1+1 Special Set,Real Barrier,https://global.oliveyoung.com/product/detail?prdtNo=GA240322564,4.4,US$28.00,Face Sunscreen
Cell Fusion C Laser UV Sunscreen 35mL 1+1 Special Set,Cell Fusion C,https://global.oliveyoung.com/product/detail?prdtNo=GA240121621,4.6,US$34.00,Face Sunscreen
ETUDE Soonjung Director’s Mineral Filter Sun Cream 50ml 1+1 Set,ETUDE,https://global.oliveyoung.com/product/detail?prdtNo=GA250228497,4.3,US$26.56,Face Sunscreen
[DISNEY EDITION] INNISFREE Vita C Tone Up Sunscreen 50ml 1+1 Set,INNISFREE,https://global.oliveyoung.com/product/detail?prdtNo=GA250732098,4.8,US$26.50,Face Sunscreen
LANEIGE Water Bank UV Barrier Sunscreen 50ml Set (+smart tok) (GGAMJA collabo),LANEIGE,https://global.oliveyoung.com/product/detail?prdtNo=GA250631432,5.0,US$26.40,Face Sunscreen
espoir Water Splash Sun Cream Tone Up Lasting 50ml,espoir,https://global.oliveyoung.com/product/detail?prdtNo=GA250128042,4.1,US$26.00,Face Sunscreen
VT PDRN Essence Glow Sun Pact,VT,https://global.oliveyoung.com/product/detail?prdtNo=GA250329473,4.0,US$25.90,Face Sunscreen
Dr.G Red Blemish Soothing Up Sun Stick 21g,Dr.G,https://global.oliveyoung.com/product/detail?prdtNo=GA230217720,4.5,US$14.38,Face Sunscreen
Dr.G Black Snail Glutathione Tone Up Sun 50mL,Dr.G,https://global.oliveyoung.com/product/detail?prdtNo=GA230920315,4.5,US$24.63,Face Sunscreen
[DISNEY EDITION] INNISFREE Green Tea Hyaluronic Sun Serum 50ml 1+1 Set,INNISFREE,https://global.oliveyoung.com/product/detail?prdtNo=GA250732097,5.0,US$24.01,Face Sunscreen
Haruharu wonder Black Rice Moisture Airy Fit Daily Sunscreen 50mL,Haruharu wonder,https://global.oliveyoung.com/product/detail?prdtNo=GA230619154,4.7,US$24.00,Face Sunscreen
Cell Fusion C Derma Relief Sunscreen 100 SPF50+/PA++++ 50ml (+20ml),Cell Fusion C,https://global.oliveyoung.com/product/detail?prdtNo=GA240825009,,US$23.48,Face Sunscreen
Dr.G Pore Blur Up Sun 50mL Special Set (+20mL),Dr.G,https://global.oliveyoung.com/product/detail?prdtNo=GA240222105,4.6,US$23.18,Face Sunscreen
Cell Fusion C Advanced Clear Sunscreen 100 Twin Pack SPF50+/PA++++ (35ml + 35ml),Cell Fusion C,https://global.oliveyoung.com/product/detail?prdtNo=GA210610841,4.5,US$23.10,Face Sunscreen
[GANADI EDITION] Torriden Dive-In Moisture Sun Cream 60ml 1+1 Set,Torriden,https://global.oliveyoung.com/product/detail?prdtNo=GA250732234,4.0,US$23.08,Face Sunscreen
AHC Masters Aqua Rich Sun Cream 1+1 Duo Set (Collaboration with Pak Seri),AHC,https://global.oliveyoung.com/product/detail?prdtNo=GA210610868,4.9,US$22.40,Face Sunscreen
Shingmulnara Soft Face & Body Sun Stick 30g 1+1 Set,Shingmulnara,https://global.oliveyoung.com/product/detail?prdtNo=GA250229054,4.8,US$22.27,Face Sunscreen
bewants Skin Fit Essence Moisture Sunscreen 50ml,bewants,https://global.oliveyoung.com/product/detail?prdtNo=GA250732230,5.0,US$10.99,Face Sunscreen
[DISNEY EDITION] goodal Heartleaf Calming Tone Up Sun Cream 50ml 1+1 Set,goodal,https://global.oliveyoung.com/product/detail?prdtNo=GA250530810,4.9,US$21.15,Face Sunscreen
KAHI Airy Fit Sun Stick 14g,KAHI,https://global.oliveyoung.com/product/detail?prdtNo=GA240724465,4.6,US$21.08,Face Sunscreen
TOCOBO Cica Cooling Sun Stick 18g,TOCOBO,https://global.oliveyoung.com/product/detail?prdtNo=GA240423261,4.7,US$20.90,Face Sunscreen
INNISFREE Hyaluron Moist Sunscreen SPF50+ PA++++ 50mL,INNISFREE,https://global.oliveyoung.com/product/detail?prdtNo=GA230820000,4.8,US$20.88,Face Sunscreen
BANILA CO UV Defense Waterproof Sunscreen 100ml,BANILA CO,https://global.oliveyoung.com/product/detail?prdtNo=GA250531071,5.0,US$20.30,Face Sunscreen
Isntree Hyaluronic Acid Airy Sun Stick 22g,Isntree,https://global.oliveyoung.com/product/detail?prdtNo=GA220815814,4.7,US$19.88,Face Sunscreen
[Limited Set] goodal Heartleaf Calming Mineral Filter Sun Cream 50mL 1+1 Special Set,goodal,https://global.oliveyoung.com/product/detail?prdtNo=GA230418215,4.6,US$19.25,Face Sunscreen
celimax Brightening Pore+Dark Spot Sunscreen 50ml Set (+10ml),celimax,https://global.oliveyoung.com/product/detail?prdtNo=GA250531073,5.0,US$18.90,Face Sunscreen
beplain Sun Muse Mineral Sunscreen,beplain,https://global.oliveyoung.com/product/detail?prdtNo=GA230418364,4.4,US$18.35,Face Sunscreen
[Large Size] AHC Natural Perfection Fresh Sun Stick 22g,AHC,https://global.oliveyoung.com/product/detail?prdtNo=GA230418183,4.7,US$22.00,Face Sunscreen
Beauty of Joseon Relief Sun : Rice + Probiotics 50mL,Beauty of Joseon,https://global.oliveyoung.com/product/detail?prdtNo=GA220816046,4.8,US$18.00,Face Sunscreen
Scinic Enjoy Super Active Airy Sun Stick 15g,Scinic,https://global.oliveyoung.com/product/detail?prdtNo=GA210001660,4.5,US$9.00,Face Sunscreen
PHYSIOGEL Red Soothing Cica Balance Pore Solution Sunscreen 30ml Double Pack,PHYSIOGEL,https://global.oliveyoung.com/product/detail?prdtNo=GA240624157,4.7,US$17.29,Face Sunscreen
Isntree Hyaluronic Acid Fresh Sun Serum 50ml,Isntree,https://global.oliveyoung.com/product/detail?prdtNo=GA250228715,4.7,US$16.88,Face Sunscreen
BRINGGREEN Tea Tree Cica Fresh Sun Cream 50ml*2ea Set (+Mini Sun Cushion 5g),BRINGGREEN,https://global.oliveyoung.com/product/detail?prdtNo=GA250530598,,US$20.76,Face Sunscreen
numbuzin No. 1 Clear Filter Sun Essence SPF50+ PA++++,numbuzin,https://global.oliveyoung.com/product/detail?prdtNo=GA230619383,4.6,US$16.80,Face Sunscreen
Cure Water Splash Cooling Sun Stick 23g,Cure,https://global.oliveyoung.com/product/detail?prdtNo=GA220313930,4.7,US$16.14,Face Sunscreen
SOME BY MI Truecica Natural Calming Tone-Up Suncream 50ml,SOME BY MI,https://global.oliveyoung.com/product/detail?prdtNo=GA240523366,4.4,US$15.68,Face Sunscreen
Isntree Onion Fresh Light Sun Stick 22g,Isntree,https://global.oliveyoung.com/product/detail?prdtNo=GA240322672,4.5,US$17.63,Face Sunscreen
COSRX Ultra-Light Invisible Sunscreen SPF50+ PA++++ 50ml,COSRX,https://global.oliveyoung.com/product/detail?prdtNo=GA240724528,4.7,US$13.76,Face Sunscreen
Dr.G Pore Blur Up Sun Stick 19g,Dr.G,https://global.oliveyoung.com/product/detail?prdtNo=GA240423054,4.4,US$13.75,Face Sunscreen
Shingmulnara White Rice Bright Tone Up Moisture Sun Cream 100mL,Shingmulnara,https://global.oliveyoung.com/product/detail?prdtNo=GA240322592,4.5,US$12.84,Face Sunscreen
BRINGGREEN Tea Tree Cica Cooling Sun Stick 20g_NEW,BRINGGREEN,https://global.oliveyoung.com/product/detail?prdtNo=GA240322581,4.7,US$14.40,Face Sunscreen
Shingmulnara Multi Sun Powder 4g,Shingmulnara,https://global.oliveyoung.com/product/detail?prdtNo=GA250329671,4.4,US$11.36,Face Sunscreen
APLB Glutathione Niacinamide Sunscreen 40mL,APLB,https://global.oliveyoung.com/product/detail?prdtNo=GA240322453,4.6,US$9.95,Face Sunscreen
BRINGGREEN Aloe 97% Soothing Gel 300ml,BRINGGREEN,https://global.oliveyoung.com/product/detail?prdtNo=GA241227206,5.0,US$8.00,Face Sunscreen
SOME BY MI V10 Hyal Air Fit Sunscreen 50mL DOUBLE SET (+ Lacto Soy Enzyme Deep Cleansing Foam),SOME BY MI,https://global.oliveyoung.com/product/detail?prdtNo=GS250832747,4.7,US$29.99,Face Sunscreen
Purito Seoul Daily Soft Touch Sunscreen 60ml + Daily Soft Touch Sun Stick SET,Purito Seoul,https://global.oliveyoung.com/product/detail?prdtNo=GS250832679,4.9,US$32.99,Face Sunscreen
Isntree Hyaluronic Suncare Special Set,Isntree,https://global.oliveyoung.com/product/detail?prdtNo=GS250631878,4.7,US$45.90,Face Sunscreen
MEDIHEAL Madecassoside Moisture Sun Serum Blemish Repair Double Set,MEDIHEAL,https://global.oliveyoung.com/product/detail?prdtNo=GA250732437,,US$41.00,Face Sunscreen
OBge Pore Zero Oil Control Sun Cream 50ml,OBge,https://global.oliveyoung.com/product/detail?prdtNo=GA250732233,,US$20.68,Face Sunscreen
dollop Ritual Invisible UV Defense 50ml,dollop,https://global.oliveyoung.com/product/detail?prdtNo=GA250732231,,US$27.17,Face Sunscreen
bewants Skin Fit Essence Tone Up Sunscreen 50ml,bewants,https://global.oliveyoung.com/product/detail?prdtNo=GA250732229,4.0,US$10.99,Face Sunscreen
Dewytree Urban Shade Moisture Serum Sun 50ml Double Pack,Dewytree,https://global.oliveyoung.com/product/detail?prdtNo=GA250732191,,US$28.00,Face Sunscreen
ROUND LAB Pine Calming Cica Mild-Up Sunscreen 40ml Set (+Pine Cleanser 10ml),ROUND LAB,https://global.oliveyoung.com/product/detail?prdtNo=GA250732190,5.0,US$18.55,Face Sunscreen
ROUND LAB Pine Calming Cica Sunscreen 40ml,ROUND LAB,https://global.oliveyoung.com/product/detail?prdtNo=GA250732189,,US$18.55,Face Sunscreen
ROUND LAB Pine Calming Cica Airy Sun Stick 19g Double Set,ROUND LAB,https://global.oliveyoung.com/product/detail?prdtNo=GA250732137,5.0,US$29.19,Face Sunscreen
Shingmulnara Jeju Aloe Cooling Sun Stick 19g Refill Set (+Aloe Gel 100ml),Shingmulnara,https://global.oliveyoung.com/product/detail?prdtNo=GA250732121,,US$18.35,Face Sunscreen
dewdap Cicatea Calming Aqua Sun Cream 50ml,dewdap,https://global.oliveyoung.com/product/detail?prdtNo=GA250732082,,US$16.31,Face Sunscreen
NUNIES Moisturizing Sun Cream 40ml,NUNIES,https://global.oliveyoung.com/product/detail?prdtNo=GA250731995,,US$23.10,Face Sunscreen
Shingmulnara White Rice Green Tone Up Moisture Sun Cream 100ml,Shingmulnara,https://global.oliveyoung.com/product/detail?prdtNo=GA250731906,,US$12.84,Face Sunscreen
GOONGBE Waterful Sun Lotion Mild 60g,GOONGBE,https://global.oliveyoung.com/product/detail?prdtNo=GA250731897,,US$16.80,Face Sunscreen
COSRX Ultra-Light Invisible Sunscreen 50ml Set (+15ml),COSRX,https://global.oliveyoung.com/product/detail?prdtNo=GA250631831,5.0,US$15.48,Face Sunscreen
FROMRIER EGF Cica Mineral Sunscreen 60g,FROMRIER,https://global.oliveyoung.com/product/detail?prdtNo=GA250631830,,US$27.30,Face Sunscreen
DPPR Hyalcube Essence Sun Cream 50ml,DPPR,https://global.oliveyoung.com/product/detail?prdtNo=GA250631827,,US$17.76,Face Sunscreen
ZIGTAG Non-Nano Hyper Shield Sunscreen 50ml,ZIGTAG,https://global.oliveyoung.com/product/detail?prdtNo=GA250631824,,US$22.05,Face Sunscreen
TODAY With Soft Moisture Sunblock Cream 60ml,todaywith,https://global.oliveyoung.com/product/detail?prdtNo=GA250631823,,US$29.00,Face Sunscreen
UIQ Biome Remedy Tone-up Sun Cream Green 50ml,UIQ,https://global.oliveyoung.com/product/detail?prdtNo=GA250631820,,US$25.60,Face Sunscreen
SKIN&LAB Barrierderm Comfort Sun Cream 50ml,SKIN&LAB,https://global.oliveyoung.com/product/detail?prdtNo=GA250631819,,US$26.40,Face Sunscreen
anotherface Niathione Radiance Tone Up Sun Cream 50ml,anotherface,https://global.oliveyoung.com/product/detail?prdtNo=GA250631818,,US$19.60,Face Sunscreen
anotherface Peptathenol Aqua Barrier Sun Cream 50ml,anotherface,https://global.oliveyoung.com/product/detail?prdtNo=GA250631817,,US$18.90,Face Sunscreen
nutseline Cica Nut Hyal Sun Serum 50ml,nutseline,https://global.oliveyoung.com/product/detail?prdtNo=GA250631814,,US$22.70,Face Sunscreen
nutseline Cica Nut Waterful Camling Sun Stick 20g,nutseline,https://global.oliveyoung.com/product/detail?prdtNo=GA250631813,,US$34.06,Face Sunscreen
dasique Aqua Shell Sun Cream 50ml,dasique,https://global.oliveyoung.com/product/detail?prdtNo=GA250531075,5.0,US$22.00,Face Sunscreen
HEVEBLUE Phyton Squa Hyal Blue Tone Up Sun Cushion 15g,HEVEBLUE,https://global.oliveyoung.com/product/detail?prdtNo=GA250531074,,US$45.00,Face Sunscreen
MISSHA Glow Skin Tinted Tone Up Sun 30ml,MISSHA,https://global.oliveyoung.com/product/detail?prdtNo=GA250531072,4.0,US$26.40,Face Sunscreen
Flaner Peach Yogurt Tone Up Sun Cream 45ml,Flaner,https://global.oliveyoung.com/product/detail?prdtNo=GA250531070,5.0,US$24.50,Face Sunscreen
B.READY Hydro Sweatproof Sunscreen Double Pack (50ml+50ml),B.READY,https://global.oliveyoung.com/product/detail?prdtNo=GA250531069,,US$40.85,Face Sunscreen
VT Airy Sun Cream 50ml,VT,https://global.oliveyoung.com/product/detail?prdtNo=GA250531065,4.8,US$17.40,Face Sunscreen
[DISNEY EDITION] espoir Water Splash Sun Cream Ceramide 60ml,espoir,https://global.oliveyoung.com/product/detail?prdtNo=GA250531049,5.0,US$20.80,Face Sunscreen
[DISNEY EDITION] espoir Water Splash Sun Cream Tone Up Lasting 50ml (2506),espoir,https://global.oliveyoung.com/product/detail?prdtNo=GA250531048,4.6,US$26.00,Face Sunscreen
easydew Mela B Toning Ampoule Cushion 13g Set (Original Product 13g+Refill 13g),easydew,https://global.oliveyoung.com/product/detail?prdtNo=GA250531047,4.0,US$61.05,Face Sunscreen
easydew Mela B Toning UV Sun Serum 40ml*2ea Set,easydew,https://global.oliveyoung.com/product/detail?prdtNo=GA250531046,5.0,US$35.00,Face Sunscreen
