prdtName,Brand,url,rating-info,price,type
PHYSIOGEL Red Soothing AI Glow Up Sunscreen 30ml,PHYSIOGEL,https://global.oliveyoung.com/product/detail?prdtNo=GA240624159,5.0,US$32.80,Face Sunscreen
PHYSIOGEL DMT Hydro Essential Sunscreen 30ml,PHYSIOGEL,https://global.oliveyoung.com/product/detail?prdtNo=GA240624158,,US$32.80,Face Sunscreen
herbloom Calming Days Vegan Sunscreen 50ml,herbloom,https://global.oliveyoung.com/product/detail?prdtNo=GA240624144,,US$23.10,Face Sunscreen
herbloom Daily Tone Up Vegan Sunscreen 50ml,herbloom,https://global.oliveyoung.com/product/detail?prdtNo=GA240624143,,US$23.10,Face Sunscreen
Purito Seoul Wonder Releaf Centella Daily Sun Lotion SPF50+ PA++++ 60mL,Purito Seoul,https://global.oliveyoung.com/product/detail?prdtNo=GA240624135,4.6,US$17.60,Face Sunscreen
mixsoon Centella Sun Cream 50ml,mixsoon,https://global.oliveyoung.com/product/detail?prdtNo=GA240624116,4.8,US$22.50,Face Sunscreen
mixsoon Shield Fit Pure Sun Cream 50ml,mixsoon,https://global.oliveyoung.com/product/detail?prdtNo=GA240624115,4.9,US$25.20,Face Sunscreen
B.READY Blue Hydro Sunscreen 50ml 1+1 Set,B.READY,https://global.oliveyoung.com/product/detail?prdtNo=GA240623945,5.0,US$26.10,Face Sunscreen
ETUDE Soonjung Director’s Toen-Up Correcting Sun Cream 40ml 1+1 Set,ETUDE,https://global.oliveyoung.com/product/detail?prdtNo=GA240523827,4.5,US$26.10,Face Sunscreen
Cell Fusion C Bluring Tone-Up Sun Base SPF50+/PA++++ 40ml,Cell Fusion C,https://global.oliveyoung.com/product/detail?prdtNo=GA240523815,5.0,US$29.70,Face Sunscreen
Cell Fusion C Clear Tone-Up Sun Base SPF50+/PA++++ 40ml,Cell Fusion C,https://global.oliveyoung.com/product/detail?prdtNo=GA240523814,5.0,US$29.70,Face Sunscreen
Cell Fusion C Water Fit Tone-Up Sun Base SPF50+/PA++++ 40ml,Cell Fusion C,https://global.oliveyoung.com/product/detail?prdtNo=GA240523813,,US$29.70,Face Sunscreen
rataplan Minari Calming Poreless Sun Cream 50ml,rataplan,https://global.oliveyoung.com/product/detail?prdtNo=GA240523794,,US$29.00,Face Sunscreen
rataplan Minari Calming Oil Control Sun Stick 19g,rataplan,https://global.oliveyoung.com/product/detail?prdtNo=GA240523793,5.0,US$29.00,Face Sunscreen
Primera Men In The Pink Repairing Cera-Capsule UV Protector Toning Effector 40ml,Primera,https://global.oliveyoung.com/product/detail?prdtNo=GA240523617,5.0,US$29.16,Face Sunscreen
FROMRIER EGF Cica Water Sun Ampoule 56ml,FROMRIER,https://global.oliveyoung.com/product/detail?prdtNo=GA240523616,4.8,US$39.00,Face Sunscreen
O HUI Day Shield Sunquid 50ml,O HUI,https://global.oliveyoung.com/product/detail?prdtNo=GA240523610,4.8,US$49.00,Face Sunscreen
EDIT.B Sunday Cica Sun Serum 55ml SPF50+ PA++++,EDIT.B,https://global.oliveyoung.com/product/detail?prdtNo=GA240523602,4.5,US$20.30,Face Sunscreen
EDIT.B Sunday No Sebum Sun Cream 50ml SPF50+ PA++++,EDIT.B,https://global.oliveyoung.com/product/detail?prdtNo=GA240523601,4.0,US$20.30,Face Sunscreen
ROVECTIN Calming / Sensitive Lotus Sun Cream 35ml 1+1 Set,ROVECTIN,https://global.oliveyoung.com/product/detail?prdtNo=GA240523561,4.9,US$55.00,Face Sunscreen
SOME BY MI Truecica Aqua Calming Suncream 50ml,SOME BY MI,https://global.oliveyoung.com/product/detail?prdtNo=GA240523365,5.0,US$15.68,Face Sunscreen
iUNIK Centella Calming Daily Sunscreen,iUNIK,https://global.oliveyoung.com/product/detail?prdtNo=GA240523362,4.4,US$14.40,Face Sunscreen
PHYSIOGEL Red Soothing AI Sensitive UV Sunscreen Advanced 80ml Large Size,PHYSIOGEL,https://global.oliveyoung.com/product/detail?prdtNo=GA240423265,4.2,US$34.88,Face Sunscreen
TOCOBO Cica Calming Sun Serum 50ml,TOCOBO,https://global.oliveyoung.com/product/detail?prdtNo=GA240423260,4.6,US$17.10,Face Sunscreen
Theralogic Madecell Derma Repair B5 Sun Cream 50ml,Theralogic,https://global.oliveyoung.com/product/detail?prdtNo=GA240423259,,US$25.00,Face Sunscreen
Anua Matte But Glow Cover Beige 50ml Double Pack,Anua,https://global.oliveyoung.com/product/detail?prdtNo=GA240423252,4.0,US$40.00,Face Sunscreen
LazySOCIETY Hinoki Sunscreen 50mL,LazySOCIETY,https://global.oliveyoung.com/product/detail?prdtNo=GA240423117,4.8,US$18.00,Face Sunscreen
AMUSE Dew Moisture 365 Vegan Sunscreen 40mL,AMUSE,https://global.oliveyoung.com/product/detail?prdtNo=GA240423107,4.5,US$28.00,Face Sunscreen
Anua Matte But Glow Cover Beige 50mL,Anua,https://global.oliveyoung.com/product/detail?prdtNo=GA240423079,4.4,US$17.41,Face Sunscreen
BIODANCE Skin Barrier Sun Safe 30mL,BIODANCE,https://global.oliveyoung.com/product/detail?prdtNo=GA240423060,4.7,US$19.55,Face Sunscreen
COSRX Vitamin E Vitalizing Sunscreen SPF 50+,COSRX,https://global.oliveyoung.com/product/detail?prdtNo=GA240322874,4.6,US$24.00,Face Sunscreen
Primera Repairing Cera-Capsule UV Protector Tone Up Priming 40mL,Primera,https://global.oliveyoung.com/product/detail?prdtNo=GA240322854,4.3,US$40.00,Face Sunscreen
Cure Water Splash Cooling Sun Stick 23g Double Set,Cure,https://global.oliveyoung.com/product/detail?prdtNo=GA240322851,4.8,US$28.95,Face Sunscreen
OBge Daily Moisture Sun Cream 50mL,OBge,https://global.oliveyoung.com/product/detail?prdtNo=GA240322844,4.4,US$17.48,Face Sunscreen
ECLADO UV Collagen 5000 Sun Cream 40g Special St (+Soothing Gel 40g),ECLADO,https://global.oliveyoung.com/product/detail?prdtNo=GA240322843,,US$31.20,Face Sunscreen
ECLADO UV Milk Protein Sun Cream 40g Special Set (+Soothing Gel 40g),ECLADO,https://global.oliveyoung.com/product/detail?prdtNo=GA240322842,4.5,US$39.00,Face Sunscreen
Shingmulnara White Rice Bright Tone Up Cover Sun Cream 50mL,Shingmulnara,https://global.oliveyoung.com/product/detail?prdtNo=GA240322836,4.5,US$18.00,Face Sunscreen
Shingmulnara UV Block Outdoor Sun Patch (2ea*5 SETS),Shingmulnara,https://global.oliveyoung.com/product/detail?prdtNo=GA240322835,4.6,US$6.98,Face Sunscreen
Bushman Sea Friendly Bronze Tanning Oil 190mL,Bushman,https://global.oliveyoung.com/product/detail?prdtNo=GA240322826,,US$29.05,Face Sunscreen
Mary&May Vegan Primer Glow Sun Cream SPF50+ PA++++ 50mL,Mary&May,https://global.oliveyoung.com/product/detail?prdtNo=GA240322678,4.6,US$18.00,Face Sunscreen
Mary&May Vegan Blackberry Complex Multi Sun Balm SPF50+ PA++++ 10g,Mary&May,https://global.oliveyoung.com/product/detail?prdtNo=GA240322677,4.3,US$21.00,Face Sunscreen
Mary&May Vegan Niacinamide Panthenol Sun Cushion SPF50+ PA++++ 25g,Mary&May,https://global.oliveyoung.com/product/detail?prdtNo=GA240322676,,US$25.99,Face Sunscreen
Isntree Onion Fresh Fluid Sun Cream 50mL,Isntree,https://global.oliveyoung.com/product/detail?prdtNo=GA240322673,4.7,US$18.38,Face Sunscreen
TOXNFILL UV Expert All In One Sun Stick 18g,TOXNFILL,https://global.oliveyoung.com/product/detail?prdtNo=GA240322609,5.0,US$44.00,Face Sunscreen
belif Super Drops - Multi Vitamin Sunquid 50mL,belif,https://global.oliveyoung.com/product/detail?prdtNo=GA240322588,5.0,US$33.60,Face Sunscreen
BRINGGREEN Tea Tree Cica Fresh Sun Cream 50mL,BRINGGREEN,https://global.oliveyoung.com/product/detail?prdtNo=GA240322583,4.1,US$14.40,Face Sunscreen
BRINGGREEN Tea Tree Cica Tone-Up Sun Cushion 15g_NEW,BRINGGREEN,https://global.oliveyoung.com/product/detail?prdtNo=GA240322582,4.4,US$14.40,Face Sunscreen
BIOHEAL BOH Probioderm Collagen Tone-UP Sun Cream 1+1 Special Set,BIOHEAL BOH,https://global.oliveyoung.com/product/detail?prdtNo=GA240322578,4.4,US$22.75,Face Sunscreen
makeprem Glow Beige Tone Up Sun Cream 40mL 1+1 Special Set,makeprem,https://global.oliveyoung.com/product/detail?prdtNo=GA240322570,4.2,US$27.41,Face Sunscreen
MEDIHEAL Moisture Tone-Up Sun Cream 50g Vitamin C,MEDIHEAL,https://global.oliveyoung.com/product/detail?prdtNo=GA240322569,4.2,US$18.12,Face Sunscreen
MEDIHEAL Moisture UV Cut Sun Cream 50g Hyaluronate,MEDIHEAL,https://global.oliveyoung.com/product/detail?prdtNo=GA240322567,4.4,US$23.00,Face Sunscreen
Dinsee Premium Vegan Mild Moist Sunscreen SPF50+ PA++++ 50mL,Dinsee,https://global.oliveyoung.com/product/detail?prdtNo=GA240322548,5.0,US$24.50,Face Sunscreen
espoir Water Flash Sun Serum 50mL Special Set (+10mL),espoir,https://global.oliveyoung.com/product/detail?prdtNo=GA240322456,4.7,US$14.00,Face Sunscreen
JUNGSAEMMOOL Sunsual Active Proof Sun 70mL,JUNGSAEMMOOL,https://global.oliveyoung.com/product/detail?prdtNo=GA240322451,4.0,US$20.80,Face Sunscreen
JUNGSAEMMOOL Sunsual Eyes Sun Stick 16g,JUNGSAEMMOOL,https://global.oliveyoung.com/product/detail?prdtNo=GA240322450,4.6,US$20.80,Face Sunscreen
JUNGSAEMMOOL Sunsual Vita Capsule Sun 50mL,JUNGSAEMMOOL,https://global.oliveyoung.com/product/detail?prdtNo=GA240322449,5.0,US$24.00,Face Sunscreen
Haruharu wonder Black Bamboo Daily Soothing Sun Shield 20g,Haruharu wonder,https://global.oliveyoung.com/product/detail?prdtNo=GA240322448,4.6,US$30.84,Face Sunscreen
espoir Water Splash Sun Serum 50mL SPF50+ PA+++,espoir,https://global.oliveyoung.com/product/detail?prdtNo=GA240222370,4.6,US$14.00,Face Sunscreen
MEDI-PEEL Mooltox Hyaluronic Acid Air Fit Sun Cream 50mL Sun Cream 50mL Special Set (+20mL),MEDIPEEL,https://global.oliveyoung.com/product/detail?prdtNo=GA240222355,4.4,US$32.00,Face Sunscreen
MEDI-PEEL Mooltox Hyaluronic Acid Water Glow Sun Serum 52mL Special Set (+Sun Cream 20mL),MEDIPEEL,https://global.oliveyoung.com/product/detail?prdtNo=GA240222354,4.9,US$32.00,Face Sunscreen
MEDI-PEEL Mooltox Hyaluronic Acid Mild Tone Up Sun Cream 50mL Special Set (+20mL),MEDIPEEL,https://global.oliveyoung.com/product/detail?prdtNo=GA240222353,4.2,US$32.00,Face Sunscreen
RAWQUEST Echinacea Airy Sun Stick 19g,RAWQUEST,https://global.oliveyoung.com/product/detail?prdtNo=GA240222351,5.0,US$20.76,Face Sunscreen
GOONGBE Waterful Sun Lotion Mild 60g Double Set,GOONGBE,https://global.oliveyoung.com/product/detail?prdtNo=GA240222346,4.6,US$28.90,Face Sunscreen
GOONGBE Moisture Sun Cushion Mild 14g Refill Set (+14g Refill),GOONGBE,https://global.oliveyoung.com/product/detail?prdtNo=GA240222344,4.6,US$29.75,Face Sunscreen
JUMISO Waterfull Hyaluronic Acid Sunscreen 50mL,JUMISO,https://global.oliveyoung.com/product/detail?prdtNo=GA240222291,4.3,US$15.00,Face Sunscreen
Real Barrier Cera Moisture Barrier Sun Cream 50mL 1+1 Special Set,Real Barrier,https://global.oliveyoung.com/product/detail?prdtNo=GA240222159,4.8,US$26.98,Face Sunscreen
CNP After-Ray Cooling Sunquid 50mL,CNP,https://global.oliveyoung.com/product/detail?prdtNo=GA240222138,4.4,US$33.00,Face Sunscreen
ANESSA Perfect UV Sunscreen Mild Milk 60mL,ANESSA,https://global.oliveyoung.com/product/detail?prdtNo=GA240222128,4.7,US$43.00,Face Sunscreen
ANESSA Mineral UV Sunscreen Mild Gel 90g,ANESSA,https://global.oliveyoung.com/product/detail?prdtNo=GA240222126,5.0,US$35.00,Face Sunscreen
SOME BY MI V10 Hyal Air Fit Sunscreen 50mL,SOME BY MI,https://global.oliveyoung.com/product/detail?prdtNo=GA240222125,4.7,US$16.80,Face Sunscreen
Shingmulnara White Rice Bright Tone Sun Gel Lotion Double Set 60mL*2ea,Shingmulnara,https://global.oliveyoung.com/product/detail?prdtNo=GA240222122,4.6,US$18.37,Face Sunscreen
BIOHEAL BOH Probioderm Collagen Tone Up Sun Cream 50mL,BIOHEAL BOH,https://global.oliveyoung.com/product/detail?prdtNo=GA240121921,4.1,US$22.75,Face Sunscreen
BIOHEAL BOH Probioderm Collagen Essence Sun Cream 50mL,BIOHEAL BOH,https://global.oliveyoung.com/product/detail?prdtNo=GA240121920,4.9,US$22.75,Face Sunscreen
MARSHIQUE Serum Glow Tone Up Cushion 12g,MARSHIQUE,https://global.oliveyoung.com/product/detail?prdtNo=GA240121916,,US$37.00,Face Sunscreen
goodal Heartleaf Calming Tone Up Sun Cream 50mL 1+1 Special Set,goodal,https://global.oliveyoung.com/product/detail?prdtNo=GA240121908,4.4,US$21.15,Face Sunscreen
Dr.G Green Mild Up Sun+ 50mL,Dr.G,https://global.oliveyoung.com/product/detail?prdtNo=GA240121869,4.7,US$28.80,Face Sunscreen
SOME BY MI V10 Hyal Antioxidant Sunscreen 40mL,SOME BY MI,https://global.oliveyoung.com/product/detail?prdtNo=GA240121857,,US$16.80,Face Sunscreen
SOME BY MI V10 Hyal Hydra Capsule Sunscreen 40mL,SOME BY MI,https://global.oliveyoung.com/product/detail?prdtNo=GA240121856,4.3,US$16.80,Face Sunscreen
Shingmulnara Jeju Aloe Moisture Soothing Gel Double Set 200mL*2ea,Shingmulnara,https://global.oliveyoung.com/product/detail?prdtNo=GA240121623,4.6,US$9.55,Face Sunscreen
Shingmulnara Jeju Aloe Moisture Soothing Gel 200mL,Shingmulnara,https://global.oliveyoung.com/product/detail?prdtNo=GA240121622,5.0,US$7.00,Face Sunscreen
d'Alba Waterful Tone Up Sun Cream Purple 50mL,d'Alba,https://global.oliveyoung.com/product/detail?prdtNo=GA240121611,4.5,US$40.00,Face Sunscreen
Mary&May Vegan Peptide Bakuchiol Sun Stick SPF50+ PA++++ 18g,Mary&May,https://global.oliveyoung.com/product/detail?prdtNo=GA231221387,4.7,US$30.00,Face Sunscreen
SKIN1004 Madagascar Centella Hyalu-Cica Sunsational Kit,SKIN1004,https://global.oliveyoung.com/product/detail?prdtNo=GA231121244,4.8,US$25.00,Face Sunscreen
JUNGSAEMMOOL Masterclass Ampoule Sun 50mL,JUNGSAEMMOOL,https://global.oliveyoung.com/product/detail?prdtNo=GA231020773,4.8,US$37.00,Face Sunscreen
Haruharu wonder Black Rice Moisture Airyfit Daily Sunscreen Duo,Haruharu wonder,https://global.oliveyoung.com/product/detail?prdtNo=GA230920574,4.8,US$46.81,Face Sunscreen
Haruharu wonder Black Rice Pure Mineral Relief Daily Sunscreen Duo,Haruharu wonder,https://global.oliveyoung.com/product/detail?prdtNo=GA230920573,4.5,US$46.81,Face Sunscreen
Cure Real:oe Soothing Gel 150mL,Cure,https://global.oliveyoung.com/product/detail?prdtNo=GA230920340,4.6,US$8.36,Face Sunscreen
SKINFOOD Berry Moisturizing Sun Cream Double Set,SKINFOOD,https://global.oliveyoung.com/product/detail?prdtNo=GA230920333,4.5,US$27.20,Face Sunscreen
Isntree Onion Newpair Sunscreen 50mL,Isntree,https://global.oliveyoung.com/product/detail?prdtNo=GA230920296,4.4,US$16.65,Face Sunscreen
SKIN1004 Madagascar Centella Hyalu-Cica Silky-Fit Sun Stick 20g,SKIN1004,https://global.oliveyoung.com/product/detail?prdtNo=GA230920257,4.7,US$17.00,Face Sunscreen
Isntree Yam Root Milk Tone Up Sun Cream 50mL,Isntree,https://global.oliveyoung.com/product/detail?prdtNo=GA230920256,4.2,US$18.55,Face Sunscreen
Scinic Enjoy All Round Airy Sun Cushion EX 25g,Scinic,https://global.oliveyoung.com/product/detail?prdtNo=GA230820235,4.5,US$14.06,Face Sunscreen
FRUDIA Ultra UV Shield Sun Essence 50g,FRUDIA,https://global.oliveyoung.com/product/detail?prdtNo=GA230820025,4.5,US$12.16,Face Sunscreen
FRUDIA What's Wrong? Help Cicaderm Sun Cream 50g,FRUDIA,https://global.oliveyoung.com/product/detail?prdtNo=GA230820024,4.4,US$15.39,Face Sunscreen
BLIVU Collagen Bouncing Sunscreen 50mL,BLIVU,https://global.oliveyoung.com/product/detail?prdtNo=GA230819948,4.7,US$37.00,Face Sunscreen
HAMEL Vegan Aqua Glow Sun Serum 50mL,HAMEL,https://global.oliveyoung.com/product/detail?prdtNo=GA230819837,4.8,US$19.44,Face Sunscreen
HAMEL Vegan Relief Water Essence Sun Cream 50mL,HAMEL,https://global.oliveyoung.com/product/detail?prdtNo=GA230819836,4.0,US$33.00,Face Sunscreen
O HUI Day Shield Perfect Sun Black 30mL,O HUI,https://global.oliveyoung.com/product/detail?prdtNo=GA230719617,5.0,US$35.00,Face Sunscreen
O HUI Day Shield Aqua Sun Stick To Go 14g,O HUI,https://global.oliveyoung.com/product/detail?prdtNo=GA230719616,5.0,US$37.00,Face Sunscreen
HANYUL Pure Artemisia Watery Calming Sun Cream 50mL + 20mL Special Set,HANYUL,https://global.oliveyoung.com/product/detail?prdtNo=GA230619415,4.8,US$23.58,Face Sunscreen
TOCOBO Bio Watery Sun Cream Special Set (50mL+10mL*2ea) SPF50 PA++++,TOCOBO,https://global.oliveyoung.com/product/detail?prdtNo=GA230619407,4.8,US$20.99,Face Sunscreen
O HUI Miracle Toning Daily Sun 50mL,O HUI,https://global.oliveyoung.com/product/detail?prdtNo=GA230619405,,US$33.30,Face Sunscreen
ATRUE Origin Safe Mild Sunblock,ATRUE,https://global.oliveyoung.com/product/detail?prdtNo=GA230619403,,US$19.01,Face Sunscreen
SKIN&LAB Hybarrier Fresh Sun Lotion 50mL,SKIN&LAB,https://global.oliveyoung.com/product/detail?prdtNo=GA230619402,,US$26.00,Face Sunscreen
shaishaishai Enjoy The Sun UV Protection Cream SPF50+ PA++++ 50mL,shaishaishai,https://global.oliveyoung.com/product/detail?prdtNo=GA230619398,5.0,US$37.00,Face Sunscreen
ROVECTIN Aqua Soothing Sunscreen 1+1 Special Set,ROVECTIN,https://global.oliveyoung.com/product/detail?prdtNo=GA230619387,4.5,US$26.95,Face Sunscreen
Haruharu wonder Black Rice Pure Mineral Relief Daily Sunscreen 50mL,Haruharu wonder,https://global.oliveyoung.com/product/detail?prdtNo=GA230619156,4.5,US$24.00,Face Sunscreen
asis-tobe Pure Mineral Sun Cream 50mL,ASIS-TOBE,https://global.oliveyoung.com/product/detail?prdtNo=GA230619126,4.8,US$28.00,Face Sunscreen
REJURAN Biome Healer Youth Formula Sun Balm 19g,REJURAN,https://global.oliveyoung.com/product/detail?prdtNo=GA230619111,5.0,US$27.40,Face Sunscreen
REJURAN Biome Healer Youth Formula Suncream 50mL,REJURAN,https://global.oliveyoung.com/product/detail?prdtNo=GA230619110,5.0,US$29.00,Face Sunscreen
MISSHA All Around Safe Block Waterproof Sun Milk 70mL SPF50+/PA++++,MISSHA,https://global.oliveyoung.com/product/detail?prdtNo=GA230618881,4.7,US$16.25,Face Sunscreen
MISSHA All Around Safe Block Essence Sun Milk EX 70mL SPF50+/PA+++,MISSHA,https://global.oliveyoung.com/product/detail?prdtNo=GA230618880,4.5,US$16.25,Face Sunscreen
MISSHA All Around Safe Block Aqua Sun 50mL SPF50+/PA++++,MISSHA,https://global.oliveyoung.com/product/detail?prdtNo=GA230618879,4.6,US$9.75,Face Sunscreen
MISSHA All Around Safe Block Soft Finish Sun Milk 70mL SPF50+/PA+++,MISSHA,https://global.oliveyoung.com/product/detail?prdtNo=GA230618878,4.4,US$16.25,Face Sunscreen
TOCOBO Vita Tone Up Sun Cream 50mL,TOCOBO,https://global.oliveyoung.com/product/detail?prdtNo=GA230518862,4.4,US$23.75,Face Sunscreen
Torriden Balanceful Cica Tone Up Sun Cream 60mL,Torriden,https://global.oliveyoung.com/product/detail?prdtNo=GA230518786,4.3,US$20.30,Face Sunscreen
belif UV Protector Tone Up Sunscreen 50mL,belif,https://global.oliveyoung.com/product/detail?prdtNo=GA230518775,5.0,US$34.40,Face Sunscreen
belif UV Protector Multi Sunscreen 50mL,belif,https://global.oliveyoung.com/product/detail?prdtNo=GA230518773,,US$32.80,Face Sunscreen
INNISFREE UV Active Poreless Sun Screen 50mL,INNISFREE,https://global.oliveyoung.com/product/detail?prdtNo=GA230518755,4.7,US$20.88,Face Sunscreen
PHYSIOGEL DMT Mild Relief UV Sunscreen 40mL,PHYSIOGEL,https://global.oliveyoung.com/product/detail?prdtNo=GA230518563,4.5,US$32.80,Face Sunscreen
Cure Aqua Mild Green Sun Cream 40mL,Cure,https://global.oliveyoung.com/product/detail?prdtNo=GA230518560,4.6,US$16.12,Face Sunscreen
belif Happy Bo Mild Sunscreen 50mL,belif,https://global.oliveyoung.com/product/detail?prdtNo=GA230518549,5.0,US$31.20,Face Sunscreen
belif Happy Bo Easy Wash Sun Stick 18g,belif,https://global.oliveyoung.com/product/detail?prdtNo=GA230518547,4.3,US$28.80,Face Sunscreen
[NEW] BE READY Blue Hydro Sunscreen 50mL,B.READY,https://global.oliveyoung.com/product/detail?prdtNo=GA230518545,5.0,US$20.30,Face Sunscreen
ma:nyo Foundation-Free Sun Cream Moisture 50mL SPF50+ PA++++,ma:nyo,https://global.oliveyoung.com/product/detail?prdtNo=GA230518542,4.8,US$19.91,Face Sunscreen
D'Alba Air Fit Fresh Sun Stick 19g,d'Alba,https://global.oliveyoung.com/product/detail?prdtNo=GA230518538,4.8,US$29.40,Face Sunscreen
d'Alba Waterful Fresh Sun Cushion 25g,d'Alba,https://global.oliveyoung.com/product/detail?prdtNo=GA230518537,4.0,US$34.30,Face Sunscreen
d'Alba Waterful Tone Up Sun Cushion 15g,d'Alba,https://global.oliveyoung.com/product/detail?prdtNo=GA230518535,4.6,US$49.00,Face Sunscreen
ROUND LAB Birch Juice Moisturizing Sun Stick 19g,ROUND LAB,https://global.oliveyoung.com/product/detail?prdtNo=GA230418385,4.8,US$21.62,Face Sunscreen
ANESSA Day Serum 30mL,ANESSA,https://global.oliveyoung.com/product/detail?prdtNo=GA230418374,5.0,US$45.90,Face Sunscreen
AHC Natural Perfection Fresh Sun Stick 14g,AHC,https://global.oliveyoung.com/product/detail?prdtNo=GA230418366,4.9,US$22.00,Face Sunscreen
[NEW] rom&nd Back Me Tone Up Sun Cushion,rom&nd,https://global.oliveyoung.com/product/detail?prdtNo=GA230418352,4.5,US$21.00,Face Sunscreen
Beyond Angel Aqua Moisture Soothing Gel Double Pack (200mL + 200mL),BEYOND,https://global.oliveyoung.com/product/detail?prdtNo=GA230418284,4.8,US$11.88,Face Sunscreen
SUNGBOON EDITOR Green Tomato Pore Blurring Sun Cream 50g,SUNGBOON EDITOR,https://global.oliveyoung.com/product/detail?prdtNo=GA230418271,4.5,US$29.00,Face Sunscreen
[SUJI's PICK] SUM37 Micro-Active Sun Serum 50mL,SUM37,https://global.oliveyoung.com/product/detail?prdtNo=GA230418241,5.0,US$50.00,Face Sunscreen
[Limited Set] goodal Heartleaf Calming Cooling Sun Stick 1+1 Special Set,goodal,https://global.oliveyoung.com/product/detail?prdtNo=GA230418214,4.6,US$24.00,Face Sunscreen
Scinic Enjoy Foundation Skip Tone Up Sun Cream 50g 1+1 Special Set,Scinic,https://global.oliveyoung.com/product/detail?prdtNo=GA230418193,4.3,US$15.15,Face Sunscreen
Green Finger Forest Mild Calming Sun Cream 80mL,Green Finger,https://global.oliveyoung.com/product/detail?prdtNo=GA230418171,5.0,US$26.00,Face Sunscreen
COSRX Aloe 54.2 Aqua Tone-Up Sunscreen SPF50+,COSRX,https://global.oliveyoung.com/product/detail?prdtNo=GA230418165,4.4,US$9.73,Face Sunscreen
CAREZONE Light Fit Velvet Sun Stick 39g,CAREZONE,https://global.oliveyoung.com/product/detail?prdtNo=GA230418123,4.3,US$22.10,Face Sunscreen
Dr.ato Derma Waterproof Sun Protecter 80mL,Dr.ato,https://global.oliveyoung.com/product/detail?prdtNo=GA230318003,4.6,US$15.19,Face Sunscreen
AESTURA Derma UV365 Red Calming Tone-Up Sunscreen 40mL,AESTURA,https://global.oliveyoung.com/product/detail?prdtNo=GA230318001,4.6,US$32.80,Face Sunscreen
ROUND LAB BIRCH JUICE MOISTURIZING TONE-UP SUNSCREEN 50ml Special Set (+Cleanser 20mL),ROUND LAB,https://global.oliveyoung.com/product/detail?prdtNo=GA230317989,4.6,US$21.00,Face Sunscreen
Dewytree Urban Shade Peach-Like Tone Up Sun Stick 13g,Dewytree,https://global.oliveyoung.com/product/detail?prdtNo=GA230317839,4.5,US$33.00,Face Sunscreen
Dr.G Brightening Up Moisture Sun 50mL,Dr.G,https://global.oliveyoung.com/product/detail?prdtNo=GA230217722,4.4,US$21.26,Face Sunscreen
Dewytree Urban Shade Derma Panthenol 5 Moist Barrier Sun 1+1 Special Set (40mL+40mL),Dewytree,https://global.oliveyoung.com/product/detail?prdtNo=GA230217663,4.3,US$27.65,Face Sunscreen
Dewytree Urban Shade Cover & Fit Sun 1+1 Special Set (40mL+40mL),Dewytree,https://global.oliveyoung.com/product/detail?prdtNo=GA230217638,4.7,US$23.91,Face Sunscreen
Dewytree Urban Shade Anti-Pollution Sun 1+1 Special Set (50mL+50mL),Dewytree,https://global.oliveyoung.com/product/detail?prdtNo=GA230217637,4.7,US$35.00,Face Sunscreen
SKINFOOD Berry Moisturizing Sun Cream 50mL SPF50+ PA++++,SKINFOOD,https://global.oliveyoung.com/product/detail?prdtNo=GA230217593,4.7,US$27.00,Face Sunscreen
SKINFOOD Berry Glowing Sun Cream 50mL SPF50+ PA++++,SKINFOOD,https://global.oliveyoung.com/product/detail?prdtNo=GA230217592,4.4,US$27.00,Face Sunscreen
espoir Water Splash Sun Cream Ceramide 60mL,espoir,https://global.oliveyoung.com/product/detail?prdtNo=GA230117433,4.7,US$19.20,Face Sunscreen
TONEfitSUN Vegan Tone-up Sun Cushion (SPF50+/PA++++),TONEfitSUN,https://global.oliveyoung.com/product/detail?prdtNo=GA230117423,4.4,US$22.40,Face Sunscreen
TOCOBO Bio Watery Sun Cream 50mL,TOCOBO,https://global.oliveyoung.com/product/detail?prdtNo=GA230117396,4.7,US$22.80,Face Sunscreen
MONSIEURJ UV Cut Sun Essence Double Pack (50mL+50mL),MONSIEURJ,https://global.oliveyoung.com/product/detail?prdtNo=GA221217092,5.0,US$26.84,Face Sunscreen
HYGGEE Relief Sun Moisturizer 50mL 1+1 Special Set,HYGGEE,https://global.oliveyoung.com/product/detail?prdtNo=GA221116684,,US$21.56,Face Sunscreen
MIP UV Shield Sun Cream 50mL Special Set (50mL*2ea),MIP,https://global.oliveyoung.com/product/detail?prdtNo=GA221016504,,US$25.50,Face Sunscreen
Torriden Dive In Mild Sun Cream 60mL + 20mL Special Set,Torriden,https://global.oliveyoung.com/product/detail?prdtNo=GA220916335,4.7,US$29.00,Face Sunscreen
SKIN1004 Madagascar Centella Tone Brightening Tone-Up Sunscreen 50mL,SKIN1004,https://global.oliveyoung.com/product/detail?prdtNo=GA220715347,4.4,US$17.00,Face Sunscreen
RAJURAN Healer UV Protection Balm 19g,REJURAN,https://global.oliveyoung.com/product/detail?prdtNo=GA220715308,4.4,US$28.80,Face Sunscreen
"dear, klairs All day Airy Sunscreen SPF50+ PA++++ 50g","dear, klairs",https://global.oliveyoung.com/product/detail?prdtNo=GA220615124,4.8,US$23.00,Face Sunscreen
Dr.Different Barrier Balance Sunblock 40mL,Dr.Different,https://global.oliveyoung.com/product/detail?prdtNo=GA220615064,,US$29.75,Face Sunscreen
ma:nyo Foundation-Free Sun Cream 50mL,ma:nyo,https://global.oliveyoung.com/product/detail?prdtNo=GA220615031,4.5,US$18.70,Face Sunscreen
Cure Aqua Mild Cooling Sun Cushion Special Set 25g + Refill,Cure,https://global.oliveyoung.com/product/detail?prdtNo=GA220514906,4.6,US$32.70,Face Sunscreen
Singmulnara Oxygen Water Face & Body Sun Stick_ Double Pack,Shingmulnara,https://global.oliveyoung.com/product/detail?prdtNo=GA220514710,4.7,US$37.00,Face Sunscreen
ROUND LAB 1025 DOKDO SUNSCREEN 50ml,ROUND LAB,https://global.oliveyoung.com/product/detail?prdtNo=GA220414581,4.8,US$21.00,Face Sunscreen
d'Alba Waterfull Tone-Up Sun Cream 50mL,d'Alba,https://global.oliveyoung.com/product/detail?prdtNo=GA220414399,4.7,US$28.00,Face Sunscreen
COSNORI Mild Tone Up Sun Cream 50mL,COSNORI,https://global.oliveyoung.com/product/detail?prdtNo=GA220414345,4.5,US$19.60,Face Sunscreen
REJURAN Healer UV Protection Cream 40mL,REJURAN,https://global.oliveyoung.com/product/detail?prdtNo=GA220414302,4.3,US$28.00,Face Sunscreen
AHC Safe On Mild Sun Cushion 25g,AHC,https://global.oliveyoung.com/product/detail?prdtNo=GA220414238,4.5,US$23.21,Face Sunscreen
DEWYTREE Urban Shade Cool Calming Sun Stick 20g,Dewytree,https://global.oliveyoung.com/product/detail?prdtNo=GA220314016,4.5,US$28.00,Face Sunscreen
CKD Green Propolis All Covery Sun 1+1 Special Set (40mL+40mL),CKD Healthcare,https://global.oliveyoung.com/product/detail?prdtNo=GA220314000,4.5,US$31.00,Face Sunscreen
